,number,value,datetime_start,datetime_complete,duration,params_boosting_type,params_class_weight,params_learning_rate,params_max_depth,params_min_data_in_leaf,params_n_estimators,params_num_leaves,params_sampling_strategy,state
537,537,0.10371136515783927,2020-09-03 17:28:39.131092,2020-09-03 17:28:50.030451,0 days 00:00:10.899359,dart,balanced,1.9133379689909864,87,35,220,80,1.0,COMPLETE
538,538,0.43539701924948754,2020-09-03 17:28:50.034065,2020-09-03 17:30:08.657761,0 days 00:01:18.623696,dart,,0.1722252457655274,85,35,280,75,0.9500000000000001,COMPLETE
539,539,0.43671288909453915,2020-09-03 17:30:08.668418,2020-09-03 17:30:44.301360,0 days 00:00:35.632942,dart,,0.18685371527260058,90,40,190,70,0.9500000000000001,COMPLETE
540,540,0.44935337546037096,2020-09-03 17:30:44.306007,2020-09-03 17:32:17.831005,0 days 00:01:33.524998,dart,,0.15176703312482825,79,55,320,65,1.0,COMPLETE
541,541,0.06214739673133588,2020-09-03 17:32:17.835667,2020-09-03 17:32:24.108540,0 days 00:00:06.272873,dart,,6.4189498092855235,79,55,340,65,0.9500000000000001,COMPLETE
542,542,0.10182900938745047,2020-09-03 17:32:24.114319,2020-09-03 17:32:30.457411,0 days 00:00:06.343092,dart,,3.2766500731123536,82,55,270,70,0.9500000000000001,COMPLETE
543,543,0.04831710966293965,2020-09-03 17:32:30.462280,2020-09-03 17:32:37.702200,0 days 00:00:07.239920,dart,,4.905091432303032,83,50,310,60,1.0,COMPLETE
544,544,0.07739748568805128,2020-09-03 17:32:37.706987,2020-09-03 17:32:50.418478,0 days 00:00:12.711491,dart,,1.8924066766432266,79,55,330,65,1.0,COMPLETE
545,545,0.44738931072079435,2020-09-03 17:32:50.421812,2020-09-03 17:34:26.974644,0 days 00:01:36.552832,dart,,0.13766911325629552,81,50,360,60,0.9500000000000001,COMPLETE
546,546,0.44869729936290526,2020-09-03 17:34:26.979375,2020-09-03 17:35:07.008249,0 days 00:00:40.028874,dart,,0.14374041336248347,78,50,210,55,0.9500000000000001,COMPLETE
547,547,0.10685095642539699,2020-09-03 17:35:07.019448,2020-09-03 17:35:14.191034,0 days 00:00:07.171586,dart,,3.5645655375281606,77,50,340,55,1.0,COMPLETE
548,548,0.07858695032226229,2020-09-03 17:35:14.204132,2020-09-03 17:35:24.608982,0 days 00:00:10.404850,dart,,1.759640333833393,78,55,200,55,0.9500000000000001,COMPLETE
549,549,0.0970537756292615,2020-09-03 17:35:24.617840,2020-09-03 17:35:29.825486,0 days 00:00:05.207646,dart,,3.370758498272445,80,50,350,50,0.4,COMPLETE
550,550,0.1211456435808976,2020-09-03 17:35:29.833706,2020-09-03 17:35:43.324484,0 days 00:00:13.490778,dart,,1.8679327234603424,77,55,320,60,0.9500000000000001,COMPLETE
551,551,0.0658850933489739,2020-09-03 17:35:43.334378,2020-09-03 17:35:47.800303,0 days 00:00:04.465925,dart,,5.373160055260233,80,50,210,60,0.9500000000000001,COMPLETE
552,552,0.4346068059784029,2020-09-03 17:35:47.805064,2020-09-03 17:36:19.636796,0 days 00:00:31.831732,dart,,0.2801861580825748,77,50,190,55,1.0,COMPLETE
553,553,0.08120171705539256,2020-09-03 17:36:19.647553,2020-09-03 17:36:27.027387,0 days 00:00:07.379834,dart,,7.571824022164723,81,45,390,65,1.0,COMPLETE
554,554,0.4377398804975786,2020-09-03 17:36:27.032410,2020-09-03 17:37:02.832547,0 days 00:00:35.800137,dart,,0.11096062071180156,78,50,210,60,0.9500000000000001,COMPLETE
555,555,0.42750137927292825,2020-09-03 17:37:02.836238,2020-09-03 17:38:39.298636,0 days 00:01:36.462398,dart,,0.20924953237917643,81,45,360,60,0.9,COMPLETE
556,556,0.4310435574213048,2020-09-03 17:38:39.302306,2020-09-03 17:40:43.880611,0 days 00:02:04.578305,dart,,0.18969331870953934,79,55,380,65,1.0,COMPLETE
557,557,0.4373076198245009,2020-09-03 17:40:43.884259,2020-09-03 17:42:48.588466,0 days 00:02:04.704207,dart,,0.139279210911958,77,50,390,65,0.9500000000000001,COMPLETE
558,558,0.16165473977484765,2020-09-03 17:42:48.593095,2020-09-03 17:43:02.182516,0 days 00:00:13.589421,goss,,3.4189310954000156,81,45,370,60,0.9,COMPLETE
559,559,0.4427842956080908,2020-09-03 17:43:02.186972,2020-09-03 17:43:49.152753,0 days 00:00:46.965781,dart,,0.11269658677472211,79,55,230,65,0.9500000000000001,COMPLETE
560,560,0.06899429715220293,2020-09-03 17:43:49.158459,2020-09-03 17:43:57.726524,0 days 00:00:08.568065,dart,,2.2041757278628253,87,50,360,50,0.9500000000000001,COMPLETE
561,561,0.10097144741373916,2020-09-03 17:43:57.730300,2020-09-03 17:44:03.999574,0 days 00:00:06.269274,dart,,5.078801229529459,82,45,330,55,1.0,COMPLETE
562,562,0.44310653891702084,2020-09-03 17:44:04.009836,2020-09-03 17:46:13.082905,0 days 00:02:09.073069,dart,,0.12687490540151852,95,50,420,55,0.9500000000000001,COMPLETE
563,563,0.08365050793402033,2020-09-03 17:46:13.090473,2020-09-03 17:46:21.576473,0 days 00:00:08.486000,dart,,2.015724644152344,77,45,200,65,1.0,COMPLETE
564,564,0.08439365701943828,2020-09-03 17:46:21.584003,2020-09-03 17:46:26.788680,0 days 00:00:05.204677,dart,,3.621472754587433,85,30,220,70,0.9,COMPLETE
565,565,0.0851412837905919,2020-09-03 17:46:26.798988,2020-09-03 17:46:33.293815,0 days 00:00:06.494827,dart,,2.074196611223201,79,55,190,65,0.8,COMPLETE
566,566,0.043070366998439774,2020-09-03 17:46:33.297650,2020-09-03 17:46:37.184770,0 days 00:00:03.887120,dart,balanced,5.0297751556077746,84,45,240,60,0.35,COMPLETE
567,567,0.4338390567175905,2020-09-03 17:46:37.191847,2020-09-03 17:47:23.900243,0 days 00:00:46.708396,dart,,0.2217951495901131,76,50,230,65,0.9500000000000001,COMPLETE
568,568,0.11550538933741969,2020-09-03 17:47:23.906494,2020-09-03 17:47:32.949524,0 days 00:00:09.043030,dart,,2.047468723953338,88,45,320,60,0.9,COMPLETE
569,569,0.43670754738031087,2020-09-03 17:47:32.958124,2020-09-03 17:48:06.562696,0 days 00:00:33.604572,dart,,0.20005942709295854,80,50,180,70,1.0,COMPLETE
570,570,0.10140565382790787,2020-09-03 17:48:06.568256,2020-09-03 17:48:12.059029,0 days 00:00:05.490773,dart,,3.5789854976642657,82,55,250,60,0.9500000000000001,COMPLETE
571,571,0.08645233971955105,2020-09-03 17:48:12.067665,2020-09-03 17:48:25.241293,0 days 00:00:13.173628,dart,,1.965437213955734,76,50,420,55,0.9500000000000001,COMPLETE
572,572,0.08345256236200371,2020-09-03 17:48:25.246611,2020-09-03 17:48:30.214775,0 days 00:00:04.968164,dart,,6.022486399635833,86,40,220,80,1.0,COMPLETE
573,573,0.12177493608839647,2020-09-03 17:48:30.224416,2020-09-03 17:48:35.433197,0 days 00:00:05.208781,dart,,3.9454716862595802,78,55,210,80,0.9,COMPLETE
574,574,0.4366835682060154,2020-09-03 17:48:35.437083,2020-09-03 17:49:12.050004,0 days 00:00:36.612921,dart,,0.2203981694418848,83,45,200,70,0.9500000000000001,COMPLETE
575,575,0.4329142885131215,2020-09-03 17:49:12.060454,2020-09-03 17:50:01.064282,0 days 00:00:49.003828,dart,,0.2331167678544016,79,50,230,65,1.0,COMPLETE
576,576,0.43224246905929603,2020-09-03 17:50:01.068446,2020-09-03 17:50:51.146874,0 days 00:00:50.078428,dart,,0.1961647843089705,90,30,240,70,0.9,COMPLETE
577,577,0.07472842240915575,2020-09-03 17:50:51.150781,2020-09-03 17:50:55.845441,0 days 00:00:04.694660,dart,,9.097755463396256,82,40,190,80,0.9500000000000001,COMPLETE
578,578,0.4549096904141875,2020-09-03 17:50:55.853025,2020-09-03 17:52:01.988469,0 days 00:01:06.135444,dart,,0.1554500635038812,76,45,260,75,0.9500000000000001,COMPLETE
579,579,0.07928131979253852,2020-09-03 17:52:01.993080,2020-09-03 17:52:11.130268,0 days 00:00:09.137188,dart,,1.9999213574334629,76,50,260,80,0.9,COMPLETE
580,580,0.10025069870588851,2020-09-03 17:52:11.139280,2020-09-03 17:52:17.442782,0 days 00:00:06.303502,dart,,3.434025552067767,76,45,350,50,0.7000000000000001,COMPLETE
581,581,0.10561673326491638,2020-09-03 17:52:17.447588,2020-09-03 17:52:21.853464,0 days 00:00:04.405876,dart,,6.314129768706351,86,35,210,60,1.0,COMPLETE
582,582,0.06012958392392261,2020-09-03 17:52:21.859631,2020-09-03 17:52:25.880920,0 days 00:00:04.021289,dart,,49.61831704465273,84,55,200,70,0.9500000000000001,COMPLETE
583,583,0.42086941441785636,2020-09-03 17:52:25.885837,2020-09-03 17:52:59.300047,0 days 00:00:33.414210,dart,,0.11123116266323839,77,50,220,75,0.45000000000000007,COMPLETE
584,584,0.0764568344555139,2020-09-03 17:52:59.310140,2020-09-03 17:53:11.340167,0 days 00:00:12.030027,dart,,2.031979337647791,81,45,330,80,1.0,COMPLETE
585,585,0.4447746628363253,2020-09-03 17:53:11.348309,2020-09-03 17:53:43.397802,0 days 00:00:32.049493,dart,,0.11220586319499501,89,50,180,75,0.9,COMPLETE
586,586,0.11687402048162843,2020-09-03 17:53:43.403739,2020-09-03 17:53:54.082319,0 days 00:00:10.678580,goss,,3.582079915852901,75,55,260,80,0.9500000000000001,COMPLETE
587,587,0.04211906672117962,2020-09-03 17:53:54.086186,2020-09-03 17:53:59.075004,0 days 00:00:04.988818,dart,,71.00308758335986,81,60,240,85,0.85,COMPLETE
588,588,0.44397363544587004,2020-09-03 17:53:59.081182,2020-09-03 17:55:09.526565,0 days 00:01:10.445383,dart,,0.1809747390012095,84,45,270,65,1.0,COMPLETE
589,589,0.04380212039636535,2020-09-03 17:55:09.535893,2020-09-03 17:55:14.750841,0 days 00:00:05.214948,dart,,2.1298697312330463,78,40,160,70,0.9500000000000001,COMPLETE
590,590,0.44376097883972265,2020-09-03 17:55:14.760928,2020-09-03 17:55:59.932989,0 days 00:00:45.172061,dart,,0.15784073107525687,75,50,210,90,0.9,COMPLETE
591,591,0.040380978685195405,2020-09-03 17:55:59.943032,2020-09-03 17:56:04.794658,0 days 00:00:04.851626,dart,,4.8446557275786475,86,55,220,80,0.65,COMPLETE
592,592,0.4379749701703233,2020-09-03 17:56:04.798842,2020-09-03 17:56:35.912560,0 days 00:00:31.113718,dart,,0.1362092068490819,79,45,190,55,0.9500000000000001,COMPLETE
593,593,0.10477415987939305,2020-09-03 17:56:35.917079,2020-09-03 17:56:42.576818,0 days 00:00:06.659739,dart,balanced,2.0481485885443886,83,40,170,85,1.0,COMPLETE
594,594,0.05333950067834754,2020-09-03 17:56:42.582431,2020-09-03 17:56:47.151541,0 days 00:00:04.569110,dart,,7.147320789007543,81,35,250,75,0.85,COMPLETE
595,595,0.10556015483763985,2020-09-03 17:56:47.156282,2020-09-03 17:56:52.549223,0 days 00:00:05.392941,dart,,3.719890070286969,88,50,200,90,0.9,COMPLETE
596,596,0.09287528645039478,2020-09-03 17:56:52.559102,2020-09-03 17:57:05.974324,0 days 00:00:13.415222,dart,,1.8988530473513845,77,45,310,80,0.9500000000000001,COMPLETE
597,597,0.44398424813159265,2020-09-03 17:57:05.982292,2020-09-03 17:57:51.044917,0 days 00:00:45.062625,dart,,0.11824387147302853,75,50,230,70,0.9500000000000001,COMPLETE
598,598,0.08684905030237773,2020-09-03 17:57:51.048892,2020-09-03 17:57:56.338052,0 days 00:00:05.289160,dart,,3.4818973381697442,85,45,260,75,1.0,COMPLETE
599,599,0.4373875880401714,2020-09-03 17:57:56.342603,2020-09-03 17:58:53.615068,0 days 00:00:57.272465,dart,,0.13993153852688947,80,40,240,85,0.9,COMPLETE
600,600,0.06206448932818213,2020-09-03 17:58:53.627541,2020-09-03 17:59:01.719140,0 days 00:00:08.091599,dart,,1.9351519715565557,78,55,180,80,0.9500000000000001,COMPLETE
601,601,0.166737857384871,2020-09-03 17:59:01.730439,2020-09-03 17:59:06.724806,0 days 00:00:04.994367,dart,,5.3305288228349905,1,50,320,65,1.0,COMPLETE
602,602,0.43074495650075695,2020-09-03 17:59:06.730289,2020-09-03 17:59:45.780315,0 days 00:00:39.050026,dart,,0.15285798698843725,82,60,210,60,0.9500000000000001,COMPLETE
603,603,0.09462091945098733,2020-09-03 17:59:45.790106,2020-09-03 17:59:52.841966,0 days 00:00:07.051860,dart,,2.3131606885160148,87,45,220,90,0.9,COMPLETE
604,604,0.06849337830774438,2020-09-03 17:59:52.846377,2020-09-03 17:59:59.776338,0 days 00:00:06.929961,dart,,4.060339994080752,75,50,290,85,1.0,COMPLETE
605,605,0.4333715511389397,2020-09-03 17:59:59.781117,2020-09-03 18:00:25.993261,0 days 00:00:26.212144,dart,,0.14762140243017502,80,35,160,70,0.9500000000000001,COMPLETE
606,606,0.4532358560007495,2020-09-03 18:00:26.000698,2020-09-03 18:01:16.514056,0 days 00:00:50.513358,dart,,0.13165331031051053,84,40,230,75,0.9500000000000001,COMPLETE
607,607,0.0498486104661523,2020-09-03 18:01:16.526515,2020-09-03 18:01:25.575410,0 days 00:00:09.048895,dart,,1.953464089539407,91,40,230,75,0.9500000000000001,COMPLETE
608,608,0.4469599277984863,2020-09-03 18:01:25.579248,2020-09-03 18:02:22.069572,0 days 00:00:56.490324,dart,,0.17145198343288615,88,40,250,75,0.9,COMPLETE
609,609,0.08093608016857068,2020-09-03 18:02:22.078782,2020-09-03 18:02:27.189134,0 days 00:00:05.110352,dart,,5.408527498704682,85,35,240,75,0.9,COMPLETE
610,610,0.040612423737708424,2020-09-03 18:02:27.193906,2020-09-03 18:02:31.830051,0 days 00:00:04.636145,dart,,53.24489740384571,83,40,220,75,0.9500000000000001,COMPLETE
611,611,0.44664457412656977,2020-09-03 18:02:31.837421,2020-09-03 18:03:07.517389,0 days 00:00:35.679968,dart,,0.13190085941989904,84,45,200,70,0.9500000000000001,COMPLETE
612,612,0.09532953543414462,2020-09-03 18:03:07.526702,2020-09-03 18:03:13.277627,0 days 00:00:05.750925,dart,,3.1819665251801132,86,35,230,75,0.9,COMPLETE
613,613,0.4423819788989246,2020-09-03 18:03:13.286351,2020-09-03 18:03:56.045505,0 days 00:00:42.759154,dart,,0.1145898746982739,93,30,240,80,0.6,COMPLETE
614,614,0.43899249149573905,2020-09-03 18:03:56.049588,2020-09-03 18:05:07.622435,0 days 00:01:11.572847,dart,,0.11284825481166583,84,40,270,75,0.9500000000000001,COMPLETE
615,615,0.08448190084973999,2020-09-03 18:05:07.627113,2020-09-03 18:05:16.702251,0 days 00:00:09.075138,dart,,1.9718116315005294,86,45,210,80,0.9500000000000001,COMPLETE
616,616,0.13650591427295955,2020-09-03 18:05:16.712320,2020-09-03 18:05:26.043235,0 days 00:00:09.330915,goss,,7.731109497078428,82,45,250,70,0.9,COMPLETE
617,617,0.09119083440302937,2020-09-03 18:05:26.047050,2020-09-03 18:05:31.014002,0 days 00:00:04.966952,dart,,3.7010546772882402,81,40,220,75,0.9500000000000001,COMPLETE
618,618,0.059788882631807316,2020-09-03 18:05:31.018165,2020-09-03 18:05:38.732418,0 days 00:00:07.714253,dart,,2.092753996599081,88,45,230,80,0.9500000000000001,COMPLETE
619,619,0.050621743932787525,2020-09-03 18:05:38.737266,2020-09-03 18:05:43.404864,0 days 00:00:04.667598,dart,balanced,59.23075935156664,77,35,190,65,0.9,COMPLETE
620,620,0.4195570043509315,2020-09-03 18:05:43.408979,2020-09-03 18:06:39.812114,0 days 00:00:56.403135,dart,,0.1582058651148766,83,50,260,80,0.5,COMPLETE
621,621,0.08650997685659143,2020-09-03 18:06:39.817105,2020-09-03 18:06:44.644598,0 days 00:00:04.827493,dart,,4.761462618150477,90,45,200,75,0.9500000000000001,COMPLETE
622,622,0.05606906850319945,2020-09-03 18:06:44.649074,2020-09-03 18:06:53.745253,0 days 00:00:09.096179,dart,,1.897662479036668,74,40,240,70,0.85,COMPLETE
623,623,0.04682116851092795,2020-09-03 18:06:53.749006,2020-09-03 18:06:57.891010,0 days 00:00:04.142004,dart,,26.443162901587446,86,45,220,80,0.9,COMPLETE
624,624,0.45223112822074657,2020-09-03 18:06:57.907878,2020-09-03 18:07:41.625994,0 days 00:00:43.718116,dart,,0.1570417456115359,77,50,210,75,0.9500000000000001,COMPLETE
625,625,0.07731070218336236,2020-09-03 18:07:41.630076,2020-09-03 18:07:49.619730,0 days 00:00:07.989654,dart,,1.9870680700103505,76,50,210,75,0.9500000000000001,COMPLETE
626,626,0.08103892816858319,2020-09-03 18:07:49.627795,2020-09-03 18:07:54.733199,0 days 00:00:05.105404,dart,,6.04632415150894,78,50,230,70,0.9500000000000001,COMPLETE
627,627,0.4335290912205692,2020-09-03 18:07:54.737301,2020-09-03 18:09:26.445376,0 days 00:01:31.708075,dart,,0.17359182375271365,80,50,300,75,0.9,COMPLETE
628,628,0.437615118102966,2020-09-03 18:09:26.449456,2020-09-03 18:10:01.176980,0 days 00:00:34.727524,dart,,0.10528937810968772,76,45,200,75,0.9,COMPLETE
629,629,0.08904103713953741,2020-09-03 18:10:01.181068,2020-09-03 18:10:06.430313,0 days 00:00:05.249245,dart,,3.5616499794938776,79,50,210,70,0.9500000000000001,COMPLETE
630,630,0.025092265010562755,2020-09-03 18:10:06.438199,2020-09-03 18:10:17.164017,0 days 00:00:10.725818,dart,,1.8435107492748979,82,45,220,75,0.9500000000000001,COMPLETE
631,631,0.10825076970300891,2020-09-03 18:10:17.168018,2020-09-03 18:10:22.264982,0 days 00:00:05.096964,dart,,3.7159709633844638,74,50,190,80,0.9500000000000001,COMPLETE
632,632,0.0887757884996497,2020-09-03 18:10:22.271807,2020-09-03 18:10:31.042995,0 days 00:00:08.771188,dart,,1.8626799096249798,77,40,210,75,0.9,COMPLETE
633,633,0.1236698999002496,2020-09-03 18:10:31.050416,2020-09-03 18:10:37.937748,0 days 00:00:06.887332,dart,,4.850322472425712,83,50,360,60,0.9500000000000001,COMPLETE
634,634,0.45074628584458587,2020-09-03 18:10:37.946943,2020-09-03 18:11:27.277209,0 days 00:00:49.330266,dart,,0.15821509963629868,81,45,230,75,0.9,COMPLETE
635,635,0.09520890427200121,2020-09-03 18:11:27.286263,2020-09-03 18:11:36.991348,0 days 00:00:09.705085,dart,,1.8047148680610363,80,45,230,80,0.85,COMPLETE
636,636,0.4454483241539221,2020-09-03 18:11:36.994845,2020-09-03 18:12:20.180883,0 days 00:00:43.186038,dart,,0.1761392325377445,78,45,220,70,0.85,COMPLETE
637,637,0.08317441382339959,2020-09-03 18:12:20.185022,2020-09-03 18:12:25.742855,0 days 00:00:05.557833,dart,,3.653665390405572,75,45,230,65,0.9,COMPLETE
638,638,0.45374043911154843,2020-09-03 18:12:25.749316,2020-09-03 18:13:05.694864,0 days 00:00:39.945548,dart,,0.10079986963128482,81,50,210,80,0.85,COMPLETE
639,639,0.0828573925173999,2020-09-03 18:13:05.707111,2020-09-03 18:13:12.715266,0 days 00:00:07.008155,dart,,2.0435506072842284,78,45,200,80,0.8,COMPLETE
640,640,0.06179616588251509,2020-09-03 18:13:12.718982,2020-09-03 18:13:17.621568,0 days 00:00:04.902586,dart,,7.0740600551817,76,50,210,80,0.85,COMPLETE
641,641,0.08477805541285258,2020-09-03 18:13:17.625298,2020-09-03 18:13:23.053732,0 days 00:00:05.428434,dart,,3.365038644471608,80,45,220,80,0.85,COMPLETE
642,642,0.12696695356366886,2020-09-03 18:13:23.062488,2020-09-03 18:13:32.589153,0 days 00:00:09.526665,dart,,1.7859845851840832,78,50,210,75,0.9,COMPLETE
643,643,0.08754472768216795,2020-09-03 18:13:32.596256,2020-09-03 18:13:37.110895,0 days 00:00:04.514639,dart,,22.975336724773722,81,45,200,80,0.85,COMPLETE
644,644,0.43758320240717935,2020-09-03 18:13:37.116383,2020-09-03 18:14:10.067190,0 days 00:00:32.950807,dart,,0.11136465588109787,74,50,190,75,0.9,COMPLETE
645,645,0.43867660745962633,2020-09-03 18:14:10.076873,2020-09-03 18:15:01.333973,0 days 00:00:51.257100,dart,,0.15502844621036807,83,45,230,80,0.9,COMPLETE
646,646,0.11079890482597239,2020-09-03 18:15:01.339747,2020-09-03 18:15:10.085839,0 days 00:00:08.746092,goss,,5.322443798518188,76,40,220,75,0.9,COMPLETE
647,647,0.07038606880892138,2020-09-03 18:15:10.092921,2020-09-03 18:15:18.571184,0 days 00:00:08.478263,dart,,1.915347419542627,79,50,240,80,0.85,COMPLETE
648,648,0.0957280015539211,2020-09-03 18:15:18.575578,2020-09-03 18:15:23.386724,0 days 00:00:04.811146,dart,balanced,3.4940520497369274,85,45,180,45,0.9,COMPLETE
649,649,0.0468218154460248,2020-09-03 18:15:23.391333,2020-09-03 18:15:27.743922,0 days 00:00:04.352589,dart,,43.21566482113802,73,55,210,40,0.9,COMPLETE
650,650,0.07322983641091972,2020-09-03 18:15:27.748475,2020-09-03 18:15:34.621842,0 days 00:00:06.873367,dart,,2.026843024840407,81,45,200,85,0.8,COMPLETE
651,651,0.11373211866307058,2020-09-03 18:15:34.626256,2020-09-03 18:15:39.723571,0 days 00:00:05.097315,dart,,9.775795908327009,77,50,220,80,0.9,COMPLETE
652,652,0.07164501769735845,2020-09-03 18:15:39.728073,2020-09-03 18:15:44.704579,0 days 00:00:04.976506,dart,,4.920195747760236,74,55,240,75,0.9,COMPLETE
653,653,0.437655159439924,2020-09-03 18:15:44.708723,2020-09-03 18:16:35.309689,0 days 00:00:50.600966,dart,,0.1741942005886712,82,45,230,80,0.85,COMPLETE
654,654,0.4321289890758077,2020-09-03 18:16:35.319283,2020-09-03 18:17:08.265859,0 days 00:00:32.946576,dart,,0.16792309232680125,88,40,180,75,0.9,COMPLETE
655,655,0.1056753184166336,2020-09-03 18:17:08.273396,2020-09-03 18:17:12.635209,0 days 00:00:04.361813,dart,,3.490951039617238,79,50,190,80,0.55,COMPLETE
656,656,0.4511841798730165,2020-09-03 18:17:12.647007,2020-09-03 18:17:55.779281,0 days 00:00:43.132274,dart,,0.11125367547683664,84,45,210,85,0.9,COMPLETE
657,657,0.061814852006283394,2020-09-03 18:17:55.783371,2020-09-03 18:18:02.592061,0 days 00:00:06.808690,dart,,1.9800183414214683,86,45,200,85,0.85,COMPLETE
658,658,0.07468021110406074,2020-09-03 18:18:02.596097,2020-09-03 18:18:07.254171,0 days 00:00:04.658074,dart,,6.733790844708123,84,45,210,85,0.9,COMPLETE
659,659,0.42989563887663385,2020-09-03 18:18:07.262164,2020-09-03 18:18:51.813517,0 days 00:00:44.551353,dart,,0.24275174033540722,76,45,210,85,0.85,COMPLETE
660,660,0.06901992777196539,2020-09-03 18:18:51.817294,2020-09-03 18:19:01.697947,0 days 00:00:09.880653,dart,,1.8537194542546496,89,50,220,80,0.9,COMPLETE
661,661,0.09501138327788183,2020-09-03 18:19:01.703289,2020-09-03 18:19:07.250687,0 days 00:00:05.547398,dart,,4.744318518723057,81,45,200,85,0.9,COMPLETE
662,662,0.4399235106140463,2020-09-03 18:19:07.259842,2020-09-03 18:19:51.086904,0 days 00:00:43.827062,dart,,0.1544654720489328,78,50,210,80,0.85,COMPLETE
663,663,0.44175118460094315,2020-09-03 18:19:51.091233,2020-09-03 18:20:38.127396,0 days 00:00:47.036163,dart,,0.14992428310878553,74,45,220,85,0.9,COMPLETE
664,664,0.036651265724821205,2020-09-03 18:20:38.135836,2020-09-03 18:20:43.207017,0 days 00:00:05.071181,dart,,3.4196329026578964,85,40,170,80,0.9,COMPLETE
665,665,0.09344006269841391,2020-09-03 18:20:43.210776,2020-09-03 18:20:47.143385,0 days 00:00:03.932609,dart,,37.30560729237812,79,50,200,85,0.85,COMPLETE
666,666,0.10057478081537463,2020-09-03 18:20:47.147653,2020-09-03 18:20:56.534361,0 days 00:00:09.386708,dart,,1.7719755439680343,17,45,190,75,0.9,COMPLETE
667,667,0.453425347377047,2020-09-03 18:20:56.543552,2020-09-03 18:21:50.049929,0 days 00:00:53.506377,dart,,0.1799781531851621,87,55,230,80,0.9,COMPLETE
668,668,0.4465265413440679,2020-09-03 18:21:50.063064,2020-09-03 18:22:43.141405,0 days 00:00:53.078341,dart,,0.18773687874812378,88,55,230,80,0.9,COMPLETE
669,669,0.4443403768853763,2020-09-03 18:22:43.149232,2020-09-03 18:23:25.655597,0 days 00:00:42.506365,dart,,0.14388267582446548,90,55,220,75,0.9,COMPLETE
670,670,0.09420112371991926,2020-09-03 18:23:25.663857,2020-09-03 18:23:30.508245,0 days 00:00:04.844388,dart,,3.545364859570425,92,55,230,85,0.9,COMPLETE
671,671,0.3859662543311907,2020-09-03 18:23:30.514807,2020-09-03 18:23:41.490166,0 days 00:00:10.975359,goss,,0.12250604951127192,87,55,220,80,0.85,COMPLETE
