,number,value,datetime_start,datetime_complete,duration,params_boosting_type,params_class_weight,params_learning_rate,params_max_depth,params_min_data_in_leaf,params_n_estimators,params_num_leaves,params_sampling_strategy,state
808,808,0.057862261587917255,2020-09-03 19:08:07.168424,2020-09-03 19:08:11.968763,0 days 00:00:04.800339,dart,,4.091674382572619,82,50,280,75,0.8,COMPLETE
809,809,0.0888017038973388,2020-09-03 19:08:11.976449,2020-09-03 19:08:19.537475,0 days 00:00:07.561026,dart,,1.8080393280641363,76,45,160,80,0.9,COMPLETE
810,810,0.08539410009039974,2020-09-03 19:08:19.546584,2020-09-03 19:08:26.612322,0 days 00:00:07.065738,dart,,1.8088620015231682,73,50,170,80,0.85,COMPLETE
811,811,0.3873330746913858,2020-09-03 19:08:26.616048,2020-09-03 19:08:38.004589,0 days 00:00:11.388541,goss,,0.11349506126801129,86,45,250,70,0.75,COMPLETE
812,812,0.4525215366410638,2020-09-03 19:08:38.011213,2020-09-03 19:09:24.669644,0 days 00:00:46.658431,dart,,0.10510566390947143,79,40,240,75,0.9500000000000001,COMPLETE
813,813,0.09452638826437511,2020-09-03 19:09:24.676935,2020-09-03 19:09:29.476504,0 days 00:00:04.799569,dart,,4.52635981871929,78,40,230,75,0.9500000000000001,COMPLETE
814,814,0.08210195187645455,2020-09-03 19:09:29.481133,2020-09-03 19:09:34.170459,0 days 00:00:04.689326,dart,,7.044822749583481,77,35,260,75,0.9500000000000001,COMPLETE
815,815,0.0991187290156021,2020-09-03 19:09:34.174918,2020-09-03 19:09:38.380088,0 days 00:00:04.205170,dart,balanced,3.910717378827581,75,40,180,80,0.7000000000000001,COMPLETE
816,816,0.06881581628181718,2020-09-03 19:09:38.389488,2020-09-03 19:09:47.674167,0 days 00:00:09.284679,dart,,1.9116599464959014,79,35,240,80,0.9500000000000001,COMPLETE
817,817,0.44365720056705643,2020-09-03 19:09:47.679588,2020-09-03 19:10:32.449451,0 days 00:00:44.769863,dart,,0.17661454567449364,80,35,230,75,0.9500000000000001,COMPLETE
818,818,0.4325824024586911,2020-09-03 19:10:32.454335,2020-09-03 19:11:22.490762,0 days 00:00:50.036427,dart,,0.17558675943118618,75,40,270,70,0.6,COMPLETE
819,819,0.08372422577369587,2020-09-03 19:11:22.496620,2020-09-03 19:11:26.762422,0 days 00:00:04.265802,dart,,3.161888900691976,78,40,190,75,0.9500000000000001,COMPLETE
820,820,0.0755884871355859,2020-09-03 19:11:26.768373,2020-09-03 19:11:31.661346,0 days 00:00:04.892973,dart,,5.438146811552113,77,40,250,80,0.9500000000000001,COMPLETE
821,821,0.45198938085034274,2020-09-03 19:11:31.666280,2020-09-03 19:12:16.418849,0 days 00:00:44.752569,dart,,0.1348778380382658,81,25,230,80,0.9500000000000001,COMPLETE
822,822,0.05742337993197679,2020-09-03 19:12:16.425738,2020-09-03 19:12:20.350335,0 days 00:00:03.924597,dart,,51.763314758529916,79,45,240,80,0.9500000000000001,COMPLETE
823,823,0.10156963433605297,2020-09-03 19:12:20.355902,2020-09-03 19:12:31.307258,0 days 00:00:10.951356,dart,,1.894296061515725,80,30,230,80,1.0,COMPLETE
824,824,0.45035522184795307,2020-09-03 19:12:31.314239,2020-09-03 19:13:14.975360,0 days 00:00:43.661121,dart,,0.10514589617953006,76,45,230,80,0.9500000000000001,COMPLETE
825,825,0.07354051572762939,2020-09-03 19:13:14.979964,2020-09-03 19:13:19.480624,0 days 00:00:04.500660,dart,,8.427668685372742,81,40,240,80,0.9500000000000001,COMPLETE
826,826,0.08793813353164008,2020-09-03 19:13:19.487246,2020-09-03 19:13:24.453396,0 days 00:00:04.966150,dart,,3.2725272414916375,73,45,250,80,0.9500000000000001,COMPLETE
827,827,0.04160861290375924,2020-09-03 19:13:24.457763,2020-09-03 19:13:35.023788,0 days 00:00:10.566025,dart,,1.7223679812456945,78,40,220,90,1.0,COMPLETE
828,828,0.43756896386379934,2020-09-03 19:13:35.027916,2020-09-03 19:14:37.885959,0 days 00:01:02.858043,dart,,0.15022201612021405,81,25,260,85,0.9500000000000001,COMPLETE
829,829,0.09797188856553352,2020-09-03 19:14:37.892258,2020-09-03 19:14:42.643330,0 days 00:00:04.751072,dart,,4.8651000775825635,76,45,240,80,0.9500000000000001,COMPLETE
830,830,0.4397733965059979,2020-09-03 19:14:42.649482,2020-09-03 19:15:28.576947,0 days 00:00:45.927465,dart,,0.1440895185754618,79,15,230,85,1.0,COMPLETE
831,831,0.07833948921853316,2020-09-03 19:15:28.581741,2020-09-03 19:15:37.065873,0 days 00:00:08.484132,dart,,2.0134156826385468,82,10,220,80,0.9500000000000001,COMPLETE
832,832,0.427818623818822,2020-09-03 19:15:37.072592,2020-09-03 19:16:30.027480,0 days 00:00:52.954888,dart,,0.16996767324595846,73,20,250,80,0.9500000000000001,COMPLETE
833,833,0.07325790992722922,2020-09-03 19:16:30.032981,2020-09-03 19:16:35.171810,0 days 00:00:05.138829,dart,,3.403246479040199,79,15,230,85,0.9500000000000001,COMPLETE
834,834,0.06887351052153502,2020-09-03 19:16:35.175800,2020-09-03 19:16:47.569751,0 days 00:00:12.393951,dart,,1.8220876316847603,82,20,220,90,1.0,COMPLETE
835,835,0.09690261310220404,2020-09-03 19:16:47.573990,2020-09-03 19:16:52.500127,0 days 00:00:04.926137,dart,,6.560841554502397,75,25,270,80,0.9500000000000001,COMPLETE
836,836,0.10668213892835246,2020-09-03 19:16:52.503485,2020-09-03 19:16:57.625048,0 days 00:00:05.121563,dart,,3.408840339745841,77,25,240,80,0.9500000000000001,COMPLETE
837,837,0.4187015731063367,2020-09-03 19:16:57.631562,2020-09-03 19:18:05.758787,0 days 00:01:08.127225,dart,,0.22912328042494018,80,40,260,85,1.0,COMPLETE
838,838,0.396844255733553,2020-09-03 19:18:05.764726,2020-09-03 19:18:17.752588,0 days 00:00:11.987862,goss,,0.14232973740561997,82,45,230,75,0.9500000000000001,COMPLETE
839,839,0.4219632635444651,2020-09-03 19:18:17.759030,2020-09-03 19:19:08.384641,0 days 00:00:50.625611,dart,,0.13639212051549732,78,20,250,80,0.9,COMPLETE
840,840,0.44778213082851803,2020-09-03 19:19:08.389401,2020-09-03 19:20:21.863833,0 days 00:01:13.474432,dart,,0.14176536529031497,83,45,290,75,0.9,COMPLETE
841,841,0.06859961882585891,2020-09-03 19:20:21.872937,2020-09-03 19:20:26.567578,0 days 00:00:04.694641,dart,,4.8666152757024985,72,40,220,80,1.0,COMPLETE
842,842,0.11860693136129041,2020-09-03 19:20:26.571270,2020-09-03 19:20:33.172456,0 days 00:00:06.601186,dart,,2.0486849567716763,80,25,150,85,0.9500000000000001,COMPLETE
843,843,0.1023639797529822,2020-09-03 19:20:33.176054,2020-09-03 19:20:38.296286,0 days 00:00:05.120232,dart,,3.3790979318430043,75,45,240,70,0.9500000000000001,COMPLETE
844,844,0.44530865117049734,2020-09-03 19:20:38.303955,2020-09-03 19:21:16.420839,0 days 00:00:38.116884,dart,balanced,0.1616513544938067,77,50,210,75,0.9,COMPLETE
845,845,0.4304306947774572,2020-09-03 19:21:16.426527,2020-09-03 19:21:57.220517,0 days 00:00:40.793990,dart,,0.1363452410704062,81,30,220,75,1.0,COMPLETE
846,846,0.07240594953159682,2020-09-03 19:21:57.226025,2020-09-03 19:22:04.541284,0 days 00:00:07.315259,dart,,2.0645318427061716,83,40,230,80,0.9,COMPLETE
847,847,0.07114651969767846,2020-09-03 19:22:04.545520,2020-09-03 19:22:09.843132,0 days 00:00:05.297612,dart,,5.44347445052146,74,45,260,90,0.9500000000000001,COMPLETE
848,848,0.10423088730705407,2020-09-03 19:22:09.848448,2020-09-03 19:22:19.019825,0 days 00:00:09.171377,dart,,1.8436391904650058,79,50,250,80,0.9500000000000001,COMPLETE
849,849,0.11892338851020723,2020-09-03 19:22:19.024018,2020-09-03 19:22:23.061493,0 days 00:00:04.037475,dart,,3.7147308593626343,83,35,160,75,0.9,COMPLETE
850,850,0.4391242563158994,2020-09-03 19:22:23.069018,2020-09-03 19:23:03.150882,0 days 00:00:40.081864,dart,,0.2043845280703,71,45,220,70,0.9500000000000001,COMPLETE
851,851,0.053600073039543616,2020-09-03 19:23:03.158149,2020-09-03 19:23:10.710672,0 days 00:00:07.552523,dart,,2.0163112557471754,77,40,210,90,0.9,COMPLETE
852,852,0.06834526252913233,2020-09-03 19:23:10.714690,2020-09-03 19:23:16.233442,0 days 00:00:05.518752,dart,,3.604919735777302,80,50,280,85,1.0,COMPLETE
853,853,0.43871029505186154,2020-09-03 19:23:16.240204,2020-09-03 19:24:06.794590,0 days 00:00:50.554386,dart,,0.20453965781894107,81,45,240,80,0.9500000000000001,COMPLETE
854,854,0.08340464787116254,2020-09-03 19:24:06.799656,2020-09-03 19:24:11.360040,0 days 00:00:04.560384,dart,,6.473222479264274,84,50,240,75,0.9,COMPLETE
855,855,0.08027449506253012,2020-09-03 19:24:11.366045,2020-09-03 19:24:20.030322,0 days 00:00:08.664277,dart,,1.9887249894887429,76,25,230,80,0.9500000000000001,COMPLETE
856,856,0.4421339367174559,2020-09-03 19:24:20.034989,2020-09-03 19:24:49.952946,0 days 00:00:29.917957,dart,,0.10136278580628502,78,45,210,85,0.55,COMPLETE
857,857,0.4271530137363002,2020-09-03 19:24:49.961059,2020-09-03 19:25:14.347886,0 days 00:00:24.386827,dart,,0.12035579697179664,83,30,170,70,0.9,COMPLETE
858,858,0.05142413364695507,2020-09-03 19:25:14.352325,2020-09-03 19:25:19.111933,0 days 00:00:04.759608,dart,,3.639684344555311,73,40,230,75,0.9500000000000001,COMPLETE
859,859,0.08337271148470687,2020-09-03 19:25:19.116411,2020-09-03 19:25:26.957703,0 days 00:00:07.841292,dart,,2.003903776468513,81,50,250,80,1.0,COMPLETE
860,860,0.09405803191237307,2020-09-03 19:25:26.961938,2020-09-03 19:25:31.657978,0 days 00:00:04.696040,dart,,4.828430811025123,79,45,220,90,0.9,COMPLETE
861,861,0.440037649000793,2020-09-03 19:25:31.663004,2020-09-03 19:26:38.078040,0 days 00:01:06.415036,dart,,0.20254634630439544,75,35,270,80,0.9500000000000001,COMPLETE
862,862,0.07207861017059798,2020-09-03 19:26:38.083087,2020-09-03 19:26:42.723026,0 days 00:00:04.639939,dart,,8.458482454778355,84,50,240,75,0.9,COMPLETE
863,863,0.0757835790510611,2020-09-03 19:26:42.734014,2020-09-03 19:26:48.860842,0 days 00:00:06.126828,dart,,1.769496594778415,82,40,260,70,0.45000000000000007,COMPLETE
864,864,0.08351186018221927,2020-09-03 19:26:48.865068,2020-09-03 19:27:02.088233,0 days 00:00:13.223165,dart,,1.7631316124272085,78,45,300,75,1.0,COMPLETE
865,865,0.4389895000633131,2020-09-03 19:27:02.093655,2020-09-03 19:27:42.509289,0 days 00:00:40.415634,dart,,0.19377667362735082,81,50,210,80,0.9500000000000001,COMPLETE
866,866,0.05744831434535569,2020-09-03 19:27:42.518669,2020-09-03 19:27:46.945583,0 days 00:00:04.426914,dart,,3.6254319522729417,87,20,200,85,0.9,COMPLETE
867,867,0.1450106304506352,2020-09-03 19:27:46.950670,2020-09-03 19:27:55.154513,0 days 00:00:08.203843,goss,,6.104056832061301,84,45,230,75,0.9500000000000001,COMPLETE
868,868,0.09153317536214278,2020-09-03 19:27:55.160002,2020-09-03 19:28:03.137025,0 days 00:00:07.977023,dart,,2.01377180651684,72,40,220,85,0.9500000000000001,COMPLETE
869,869,0.04985471234447501,2020-09-03 19:28:03.141354,2020-09-03 19:28:08.407138,0 days 00:00:05.265784,dart,,3.67692138969649,76,50,250,80,0.9,COMPLETE
870,870,0.09379358042356477,2020-09-03 19:28:08.411912,2020-09-03 19:28:15.313435,0 days 00:00:06.901523,dart,balanced,1.8258448228407904,79,45,150,80,0.9500000000000001,COMPLETE
871,871,0.10499629982749889,2020-09-03 19:28:15.317175,2020-09-03 19:28:19.463999,0 days 00:00:04.146824,dart,,4.744769517414962,86,45,170,75,1.0,COMPLETE
872,872,0.06435771261397741,2020-09-03 19:28:19.470189,2020-09-03 19:28:27.145171,0 days 00:00:07.674982,dart,,1.9782124881575704,82,40,240,80,0.9,COMPLETE
873,873,0.04313480796035986,2020-09-03 19:28:27.152055,2020-09-03 19:28:36.135991,0 days 00:00:08.983936,dart,,1.7418880842885478,80,50,190,90,1.0,COMPLETE
874,874,0.07700195780379278,2020-09-03 19:28:36.140959,2020-09-03 19:28:40.867145,0 days 00:00:04.726186,dart,,3.821092685316757,75,45,210,75,0.9500000000000001,COMPLETE
875,875,0.43333852575891785,2020-09-03 19:28:40.871281,2020-09-03 19:29:27.421378,0 days 00:00:46.550097,dart,,0.1429416201492205,84,35,230,85,0.9,COMPLETE
876,876,0.08212715699750721,2020-09-03 19:29:27.427254,2020-09-03 19:29:31.916654,0 days 00:00:04.489400,dart,,6.408473279500259,77,50,220,70,0.9,COMPLETE
877,877,0.4502668516980585,2020-09-03 19:29:31.924619,2020-09-03 19:30:40.186831,0 days 00:01:08.262212,dart,,0.11147901852659321,74,40,280,75,0.9500000000000001,COMPLETE
878,878,0.0418198350048945,2020-09-03 19:30:40.191649,2020-09-03 19:30:51.337055,0 days 00:00:11.145406,dart,,1.7792026429236099,82,45,260,80,0.9500000000000001,COMPLETE
879,879,0.04979620113704436,2020-09-03 19:30:51.341959,2020-09-03 19:30:56.495207,0 days 00:00:05.153248,dart,,10.224918680318632,98,50,240,80,1.0,COMPLETE
880,880,0.4187024647627691,2020-09-03 19:30:56.500394,2020-09-03 19:31:39.180209,0 days 00:00:42.679815,dart,,0.2888279198778708,87,40,210,75,0.9,COMPLETE
881,881,0.07537741080266228,2020-09-03 19:31:39.186545,2020-09-03 19:31:43.766757,0 days 00:00:04.580212,dart,,3.307120962904485,79,45,200,75,0.9500000000000001,COMPLETE
882,882,0.4498069355886624,2020-09-03 19:31:43.771119,2020-09-03 19:32:35.277766,0 days 00:00:51.506647,dart,,0.1041795322568736,71,50,250,80,0.9,COMPLETE
883,883,0.04679496507417786,2020-09-03 19:32:35.284065,2020-09-03 19:32:38.818527,0 days 00:00:03.534462,dart,,4.781620909694746,84,45,160,15,0.9500000000000001,COMPLETE
884,884,0.0931741203500187,2020-09-03 19:32:38.823643,2020-09-03 19:32:46.404599,0 days 00:00:07.580956,dart,,1.7582956277142305,81,50,180,85,0.9,COMPLETE
885,885,0.42257135278672325,2020-09-03 19:32:46.411546,2020-09-03 19:33:35.538519,0 days 00:00:49.126973,dart,,0.2268679371365311,77,40,230,90,0.9500000000000001,COMPLETE
886,886,0.023166792233335454,2020-09-03 19:33:35.543059,2020-09-03 19:33:39.549808,0 days 00:00:04.006749,dart,,61.85569604743142,35,45,220,70,1.0,COMPLETE
887,887,0.41620345581580354,2020-09-03 19:33:39.553863,2020-09-03 19:34:19.840897,0 days 00:00:40.287034,dart,,0.2418356970950571,86,50,240,75,0.65,COMPLETE
888,888,0.4348375183326862,2020-09-03 19:34:19.849355,2020-09-03 19:35:27.107270,0 days 00:01:07.257915,dart,,0.22644005816530802,80,45,270,85,0.9,COMPLETE
889,889,0.07257633269360975,2020-09-03 19:35:27.112948,2020-09-03 19:35:31.711026,0 days 00:00:04.598078,dart,,3.116824103631153,83,40,210,80,0.9500000000000001,COMPLETE
890,890,0.10704979483753674,2020-09-03 19:35:31.717141,2020-09-03 19:35:36.268189,0 days 00:00:04.551048,dart,,4.940002948260154,78,35,230,75,0.9500000000000001,COMPLETE
891,891,0.4495514281032481,2020-09-03 19:35:36.273408,2020-09-03 19:36:34.879693,0 days 00:00:58.606285,dart,,0.10588869727737119,74,50,260,80,0.9,COMPLETE
892,892,0.08474835112847544,2020-09-03 19:36:34.885964,2020-09-03 19:36:43.697350,0 days 00:00:08.811386,dart,,1.874663574678256,88,45,200,75,1.0,COMPLETE
893,893,0.4416367280355816,2020-09-03 19:36:43.706349,2020-09-03 19:37:34.557758,0 days 00:00:50.851409,dart,,0.22808597246272438,85,55,250,70,0.9500000000000001,COMPLETE
894,894,0.44246438078152234,2020-09-03 19:37:34.561852,2020-09-03 19:38:15.333147,0 days 00:00:40.771295,dart,,0.14344074306687268,82,40,220,80,0.9,COMPLETE
895,895,0.1475919372846227,2020-09-03 19:38:15.336918,2020-09-03 19:38:23.716657,0 days 00:00:08.379739,goss,,3.328290425998929,80,50,240,85,0.9,COMPLETE
896,896,0.045292351414851835,2020-09-03 19:38:23.720497,2020-09-03 19:38:27.834901,0 days 00:00:04.114404,dart,,6.808873543977238,76,45,190,90,0.9500000000000001,COMPLETE
897,897,0.4540444525359756,2020-09-03 19:38:27.846260,2020-09-03 19:39:12.517531,0 days 00:00:44.671271,dart,,0.11927671803560971,84,55,230,75,1.0,COMPLETE
898,898,0.0516437778037778,2020-09-03 19:39:12.522537,2020-09-03 19:39:19.013265,0 days 00:00:06.490728,dart,,2.1208132166326354,88,45,220,75,1.0,COMPLETE
899,899,0.08210710187955608,2020-09-03 19:39:19.020154,2020-09-03 19:39:24.304086,0 days 00:00:05.283932,dart,balanced,3.326712122251561,86,35,230,80,1.0,COMPLETE
900,900,0.44219083591848507,2020-09-03 19:39:24.310739,2020-09-03 19:40:03.142659,0 days 00:00:38.831920,dart,,0.16643307696614612,85,50,210,75,1.0,COMPLETE
901,901,0.07759414869739475,2020-09-03 19:40:03.146989,2020-09-03 19:40:07.901474,0 days 00:00:04.754485,dart,,5.166539244806083,89,40,220,80,1.0,COMPLETE
902,902,0.0977645001818755,2020-09-03 19:40:07.909459,2020-09-03 19:40:15.373044,0 days 00:00:07.463585,dart,,1.923835281498953,84,55,200,75,1.0,COMPLETE
903,903,0.4284317162576977,2020-09-03 19:40:15.381793,2020-09-03 19:41:00.967364,0 days 00:00:45.585571,dart,,0.21862942886953107,86,45,230,75,1.0,COMPLETE
904,904,0.1052652252007749,2020-09-03 19:41:00.971474,2020-09-03 19:41:05.616704,0 days 00:00:04.645230,dart,,3.381053192430554,83,50,170,85,1.0,COMPLETE
905,905,0.0762697792406924,2020-09-03 19:41:05.623144,2020-09-03 19:41:09.235880,0 days 00:00:03.612736,dart,,27.316706245408742,88,45,150,75,1.0,COMPLETE
906,906,0.4215061667004214,2020-09-03 19:41:09.244370,2020-09-03 19:41:47.896285,0 days 00:00:38.651915,dart,,0.25206584603353027,83,40,210,80,0.9,COMPLETE
907,907,0.09414267907641519,2020-09-03 19:41:47.899600,2020-09-03 19:41:59.361681,0 days 00:00:11.462081,dart,,1.6583730351853943,86,30,230,90,0.9,COMPLETE
908,908,0.4456679759235965,2020-09-03 19:41:59.366080,2020-09-03 19:42:42.822463,0 days 00:00:43.456383,dart,,0.13679223748148872,83,50,220,80,1.0,COMPLETE
909,909,0.4451402455230367,2020-09-03 19:42:42.830651,2020-09-03 19:43:15.709384,0 days 00:00:32.878733,dart,,0.12740478910297814,85,55,200,75,0.9500000000000001,COMPLETE
910,910,0.04775640825995248,2020-09-03 19:43:15.716978,2020-09-03 19:43:19.724596,0 days 00:00:04.007618,dart,,7.666613210751375,81,45,190,80,0.9,COMPLETE
911,911,0.017896329701547704,2020-09-03 19:43:19.729797,2020-09-03 19:43:23.826120,0 days 00:00:04.096323,dart,,78.7499555800978,71,25,230,75,1.0,COMPLETE
912,912,0.05685602319691141,2020-09-03 19:43:23.829668,2020-09-03 19:43:28.001635,0 days 00:00:04.171967,dart,,4.836834559257203,84,40,180,85,0.9500000000000001,COMPLETE
913,913,0.44088505111515913,2020-09-03 19:43:28.006494,2020-09-03 19:44:10.032525,0 days 00:00:42.026031,dart,,0.17049210987163493,82,50,220,80,0.9,COMPLETE
914,914,0.10586747948282393,2020-09-03 19:44:10.038303,2020-09-03 19:44:14.773514,0 days 00:00:04.735211,dart,,3.2382049385521388,89,45,210,75,0.9500000000000001,COMPLETE
915,915,0.1497891648465992,2020-09-03 19:44:14.779717,2020-09-03 19:44:23.831564,0 days 00:00:09.051847,dart,,1.8111302444824275,87,50,240,80,0.9,COMPLETE
916,916,0.10117576502045564,2020-09-03 19:44:23.844038,2020-09-03 19:44:29.161622,0 days 00:00:05.317584,dart,,3.15188953860697,81,45,240,85,0.9500000000000001,COMPLETE
917,917,0.06797444811237388,2020-09-03 19:44:29.170880,2020-09-03 19:44:33.507650,0 days 00:00:04.336770,dart,,5.29749098259135,84,40,220,75,1.0,COMPLETE
918,918,0.09454425974129439,2020-09-03 19:44:33.511764,2020-09-03 19:44:40.934743,0 days 00:00:07.422979,dart,,1.9155524404810644,86,50,210,80,0.9,COMPLETE
919,919,0.05342335482657771,2020-09-03 19:44:40.938563,2020-09-03 19:44:46.258037,0 days 00:00:05.319474,dart,,1.9874611065180878,73,100,160,90,0.9500000000000001,COMPLETE
920,920,0.4557347525655788,2020-09-03 19:44:46.262075,2020-09-03 19:45:30.502143,0 days 00:00:44.240068,dart,,0.15480527203834132,79,55,230,75,0.9,COMPLETE
921,921,0.44857217917232795,2020-09-03 19:45:30.510562,2020-09-03 19:46:16.165523,0 days 00:00:45.654961,dart,,0.1328552533445595,79,45,240,75,0.9,COMPLETE
922,922,0.10668988725749717,2020-09-03 19:46:16.175759,2020-09-03 19:46:20.697356,0 days 00:00:04.521597,dart,,3.700590123353379,81,35,230,75,0.9,COMPLETE
923,923,0.08928505432553,2020-09-03 19:46:20.701666,2020-09-03 19:46:27.985868,0 days 00:00:07.284202,dart,,2.003114299612035,78,55,230,75,0.9,COMPLETE
924,924,0.0913575298854736,2020-09-03 19:46:27.991248,2020-09-03 19:46:32.452230,0 days 00:00:04.460982,dart,,6.050082076304166,80,50,220,70,0.9,COMPLETE
925,925,0.39941983354635663,2020-09-03 19:46:32.456466,2020-09-03 19:46:44.524105,0 days 00:00:12.067639,goss,,0.17849186118688928,83,5,240,75,0.9,COMPLETE
926,926,0.4208468130358593,2020-09-03 19:46:44.530732,2020-09-03 19:47:10.384749,0 days 00:00:25.854017,dart,,0.16634250217942123,96,40,230,30,0.9,COMPLETE
927,927,0.4388547011557889,2020-09-03 19:47:10.390561,2020-09-03 19:47:48.208856,0 days 00:00:37.818295,dart,balanced,0.1626772997828687,82,55,210,75,0.9,COMPLETE
928,928,0.04624576785031176,2020-09-03 19:47:48.212275,2020-09-03 19:47:53.130705,0 days 00:00:04.918430,dart,,3.6946823086744174,78,45,250,75,0.9,COMPLETE
929,929,0.4452511485838719,2020-09-03 19:47:53.134811,2020-09-03 19:48:32.969813,0 days 00:00:39.835002,dart,,0.10496658800029106,91,50,220,80,0.9,COMPLETE
930,930,0.07413882066626049,2020-09-03 19:48:32.975182,2020-09-03 19:48:38.876716,0 days 00:00:05.901534,dart,,2.123864363776035,80,45,200,70,0.9,COMPLETE
931,931,0.07152054932669825,2020-09-03 19:48:38.882465,2020-09-03 19:48:43.353864,0 days 00:00:04.471399,dart,,8.831893856755375,77,40,230,75,0.9500000000000001,COMPLETE
932,932,0.4411977673981086,2020-09-03 19:48:43.359581,2020-09-03 19:49:22.805320,0 days 00:00:39.445739,dart,,0.10035262365341034,85,55,220,80,0.9,COMPLETE
933,933,0.023121465191348327,2020-09-03 19:49:22.809498,2020-09-03 19:49:27.588044,0 days 00:00:04.778546,dart,,4.749560420343142,83,50,250,80,0.9500000000000001,COMPLETE
934,934,0.14874340870945374,2020-09-03 19:49:27.592131,2020-09-03 19:49:31.643660,0 days 00:00:04.051529,dart,,34.47124584458546,81,45,240,75,0.85,COMPLETE
935,935,0.420418627894969,2020-09-03 19:49:31.649226,2020-09-03 19:49:57.774845,0 days 00:00:26.125619,dart,,0.1313975904482838,79,35,210,75,0.4,COMPLETE
936,936,0.06139243479797281,2020-09-03 19:49:57.779163,2020-09-03 19:50:05.175370,0 days 00:00:07.396207,dart,,1.9851754120374472,100,40,230,70,0.9,COMPLETE
937,937,0.0837691532277767,2020-09-03 19:50:05.183825,2020-09-03 19:50:09.612684,0 days 00:00:04.428859,dart,,3.2202861578688213,87,50,200,75,0.9500000000000001,COMPLETE
938,938,0.09000168216037321,2020-09-03 19:50:09.616880,2020-09-03 19:50:16.142470,0 days 00:00:06.525590,dart,,2.1309788441303827,84,45,220,80,0.9500000000000001,COMPLETE
939,939,0.08489632338458496,2020-09-03 19:50:16.153553,2020-09-03 19:50:20.684270,0 days 00:00:04.530717,dart,,6.559998791496931,76,55,230,80,0.9,COMPLETE
940,940,0.44612656734836226,2020-09-03 19:50:20.692232,2020-09-03 19:51:05.936913,0 days 00:00:45.244681,dart,,0.12682066589851324,82,45,240,75,0.9,COMPLETE
941,941,0.43070505325487635,2020-09-03 19:51:05.942751,2020-09-03 19:51:43.558863,0 days 00:00:37.616112,dart,,0.21255800645176576,88,50,210,80,0.85,COMPLETE
