,number,value,datetime_start,datetime_complete,duration,params_boosting_type,params_class_weight,params_learning_rate,params_max_depth,params_min_data_in_leaf,params_n_estimators,params_num_leaves,params_sampling_strategy,state
0,0,0.11336065941715714,2020-09-03 15:31:27.878450,2020-09-03 15:31:36.298164,0 days 00:00:08.419714,goss,balanced,28.311344812314562,72,45,130,50,0.75,COMPLETE
1,1,0.04835645644250668,2020-09-03 15:31:36.302132,2020-09-03 15:31:39.612096,0 days 00:00:03.309964,dart,balanced,41.251816476388726,44,65,120,40,0.9,COMPLETE
2,2,0.1171248054151828,2020-09-03 15:31:39.620849,2020-09-03 15:31:42.173804,0 days 00:00:02.552955,gbdt,balanced,41.97021067697442,40,80,200,90,0.15000000000000002,COMPLETE
3,3,0.07263689650318944,2020-09-03 15:31:42.177777,2020-09-03 15:31:45.687256,0 days 00:00:03.509479,gbdt,balanced,62.65568549222859,0,60,400,15,0.1,COMPLETE
4,4,0.07298987915653797,2020-09-03 15:31:45.690598,2020-09-03 15:31:57.114061,0 days 00:00:11.423463,goss,,87.48398041661302,73,65,330,20,0.9,COMPLETE
5,5,0.1431596654758261,2020-09-03 15:31:57.119799,2020-09-03 15:32:00.012875,0 days 00:00:02.893076,goss,,12.010746748993856,30,75,70,40,0.2,COMPLETE
6,6,0.1207018077731075,2020-09-03 15:32:00.018971,2020-09-03 15:32:02.717426,0 days 00:00:02.698455,gbdt,,46.49212291654223,30,75,70,80,0.6,COMPLETE
7,7,0.11406473269351045,2020-09-03 15:32:02.723105,2020-09-03 15:32:09.336418,0 days 00:00:06.613313,goss,balanced,17.90690193035732,73,40,200,65,0.55,COMPLETE
8,8,0.1007120597392098,2020-09-03 15:32:09.340505,2020-09-03 15:32:12.936034,0 days 00:00:03.595529,gbdt,balanced,87.85461714882669,7,5,120,65,0.75,COMPLETE
9,9,0.07528238063905943,2020-09-03 15:32:12.939819,2020-09-03 15:32:23.151049,0 days 00:00:10.211230,goss,balanced,77.88726969964566,40,40,330,35,0.45000000000000007,COMPLETE
10,10,0.05834434473450008,2020-09-03 15:32:23.154716,2020-09-03 15:32:25.604690,0 days 00:00:02.449974,dart,,4.980925475415977,96,100,30,30,0.30000000000000004,COMPLETE
11,11,0.15640027884915228,2020-09-03 15:32:25.618811,2020-09-03 15:32:28.084895,0 days 00:00:02.466084,gbdt,,7.822737701046342,23,90,20,95,0.5,COMPLETE
12,12,0.1454652879384704,2020-09-03 15:32:28.093155,2020-09-03 15:32:30.434349,0 days 00:00:02.341194,goss,,2.6169806436384597,20,100,10,100,0.35,COMPLETE
13,13,0.389031895004538,2020-09-03 15:32:30.438076,2020-09-03 15:32:32.766614,0 days 00:00:02.328538,gbdt,,0.343046563795844,14,100,10,100,0.35,COMPLETE
14,14,0.061893569052980865,2020-09-03 15:32:32.774580,2020-09-03 15:32:37.348509,0 days 00:00:04.573929,gbdt,,23.822476623157673,8,90,480,95,0.4,COMPLETE
15,15,0.1763698483249678,2020-09-03 15:32:37.352477,2020-09-03 15:32:39.894017,0 days 00:00:02.541540,gbdt,,5.8327944728211145,17,100,10,80,0.65,COMPLETE
16,16,0.36809075625989846,2020-09-03 15:32:39.900184,2020-09-03 15:32:49.502970,0 days 00:00:09.602786,gbdt,,0.31544663898223835,60,20,190,80,0.7000000000000001,COMPLETE
17,17,0.03116695586474206,2020-09-03 15:32:49.507989,2020-09-03 15:32:54.254462,0 days 00:00:04.746473,gbdt,,30.72654115570046,59,15,260,80,1.0,COMPLETE
18,18,0.05230888499232519,2020-09-03 15:32:54.257944,2020-09-03 15:32:57.395237,0 days 00:00:03.137293,dart,,60.53703783201738,57,25,200,65,0.25,COMPLETE
19,19,0.37371525991596055,2020-09-03 15:32:57.401811,2020-09-03 15:33:08.277827,0 days 00:00:10.876016,gbdt,,0.6172440694444807,92,25,270,85,0.65,COMPLETE
20,20,0.1090329812855226,2020-09-03 15:33:08.287169,2020-09-03 15:33:13.078803,0 days 00:00:04.791634,gbdt,,21.74764269510188,99,30,290,90,0.85,COMPLETE
21,21,0.24439810501787398,2020-09-03 15:33:13.083140,2020-09-03 15:33:20.925729,0 days 00:00:07.842589,gbdt,,0.9765606058191021,84,5,410,75,0.7000000000000001,COMPLETE
22,22,0.3599655766262476,2020-09-03 15:33:20.934354,2020-09-03 15:33:33.990849,0 days 00:00:13.056495,gbdt,,0.2678270074319552,88,20,230,100,0.55,COMPLETE
23,23,0.08964814008117716,2020-09-03 15:33:33.995220,2020-09-03 15:33:37.483803,0 days 00:00:03.488583,gbdt,,15.933801803661382,62,15,160,85,0.8,COMPLETE
24,24,0.0725211457996147,2020-09-03 15:33:37.488953,2020-09-03 15:33:41.907581,0 days 00:00:04.418628,gbdt,,32.910433724656876,50,10,310,70,0.65,COMPLETE
25,25,0.12122666062871121,2020-09-03 15:33:41.919732,2020-09-03 15:33:45.926942,0 days 00:00:04.007210,gbdt,,13.131264983907837,86,35,370,55,0.4,COMPLETE
26,26,0.15660909376331295,2020-09-03 15:33:45.931020,2020-09-03 15:33:50.015595,0 days 00:00:04.084575,gbdt,,1.8379359383741838,65,50,270,100,0.5,COMPLETE
27,27,0.06794709075197458,2020-09-03 15:33:50.020224,2020-09-03 15:33:56.972312,0 days 00:00:06.952088,dart,,9.6649482944758,49,25,490,90,0.65,COMPLETE
28,28,0.34780795626356864,2020-09-03 15:33:56.981805,2020-09-03 15:34:07.353810,0 days 00:00:10.372005,gbdt,,0.35502046706010437,80,25,240,55,0.6,COMPLETE
29,29,0.07518790662853563,2020-09-03 15:34:07.357502,2020-09-03 15:34:10.889172,0 days 00:00:03.531670,gbdt,,24.284401074938778,94,45,150,75,0.75,COMPLETE
30,30,0.09062481563661226,2020-09-03 15:34:10.893707,2020-09-03 15:34:14.089453,0 days 00:00:03.195746,gbdt,,35.23403685885576,69,55,80,85,1.0,COMPLETE
31,31,0.10248590620953113,2020-09-03 15:34:14.096565,2020-09-03 15:34:17.923834,0 days 00:00:03.827269,gbdt,,10.33961168990037,89,15,220,100,0.55,COMPLETE
32,32,0.3810513781345442,2020-09-03 15:34:17.928768,2020-09-03 15:34:28.444797,0 days 00:00:10.516029,gbdt,,0.577947697121675,89,20,240,95,0.7000000000000001,COMPLETE
33,33,0.35465139167329746,2020-09-03 15:34:28.451813,2020-09-03 15:34:38.275110,0 days 00:00:09.823297,gbdt,,0.42195293659898975,75,30,160,95,0.8,COMPLETE
34,34,0.1259823282990404,2020-09-03 15:34:38.278318,2020-09-03 15:34:42.937795,0 days 00:00:04.659477,gbdt,,18.181194620943565,100,10,290,85,0.7000000000000001,COMPLETE
35,35,0.025787341320114614,2020-09-03 15:34:42.943532,2020-09-03 15:34:48.472976,0 days 00:00:05.529444,gbdt,,55.36989016381729,82,20,370,90,0.9,COMPLETE
36,36,0.03411145484548675,2020-09-03 15:34:48.476473,2020-09-03 15:34:51.895067,0 days 00:00:03.418594,dart,balanced,70.23467242597012,78,35,190,75,0.7000000000000001,COMPLETE
37,37,0.06525735139216729,2020-09-03 15:34:51.900953,2020-09-03 15:34:54.511827,0 days 00:00:02.610874,gbdt,,8.983001279756294,34,5,100,95,0.6,COMPLETE
38,38,0.08445709356528149,2020-09-03 15:34:54.515938,2020-09-03 15:34:57.283672,0 days 00:00:02.767734,gbdt,,38.74144173967873,-1,65,260,85,0.15000000000000002,COMPLETE
39,39,0.20466240607496747,2020-09-03 15:34:57.291107,2020-09-03 15:35:01.573503,0 days 00:00:04.282396,gbdt,,99.8069452762413,92,20,350,60,0.8,COMPLETE
40,40,0.12287949744809368,2020-09-03 15:35:01.577320,2020-09-03 15:35:04.946972,0 days 00:00:03.369652,goss,balanced,15.527092835536138,69,30,50,70,0.85,COMPLETE
41,41,0.3655731665920677,2020-09-03 15:35:04.955246,2020-09-03 15:35:12.812743,0 days 00:00:07.857497,gbdt,,0.8938210547285567,90,20,230,100,0.55,COMPLETE
42,42,0.08426327842918749,2020-09-03 15:35:12.819627,2020-09-03 15:35:15.929158,0 days 00:00:03.109531,gbdt,,5.875734236409188,99,10,180,100,0.5,COMPLETE
43,43,0.1158896022806877,2020-09-03 15:35:15.932822,2020-09-03 15:35:19.482375,0 days 00:00:03.549553,gbdt,,4.2830104575013594,92,35,220,45,0.6,COMPLETE
44,44,0.08521535996703852,2020-09-03 15:35:19.486191,2020-09-03 15:35:23.612932,0 days 00:00:04.126741,gbdt,,12.3204943112163,78,20,280,90,0.45000000000000007,COMPLETE
45,45,0.14111209049157242,2020-09-03 15:35:23.621069,2020-09-03 15:35:28.790444,0 days 00:00:05.169375,gbdt,,19.34898466029254,49,40,320,95,0.7000000000000001,COMPLETE
46,46,0.08629104129436307,2020-09-03 15:35:28.803094,2020-09-03 15:35:32.638689,0 days 00:00:03.835595,gbdt,,26.789669403646066,6,15,130,80,0.65,COMPLETE
47,47,0.13006274233174975,2020-09-03 15:35:32.648713,2020-09-03 15:35:42.471968,0 days 00:00:09.823255,goss,balanced,6.578868000464334,35,80,250,95,0.75,COMPLETE
48,48,0.4291834798346869,2020-09-03 15:35:42.480449,2020-09-03 15:35:48.299340,0 days 00:00:05.818891,gbdt,,0.25513842625874644,43,25,300,10,0.45000000000000007,COMPLETE
49,49,0.12636098152398398,2020-09-03 15:35:48.310255,2020-09-03 15:35:52.917355,0 days 00:00:04.607100,dart,,44.81570820480583,27,45,410,10,0.30000000000000004,COMPLETE
50,50,0.08832594387844155,2020-09-03 15:35:52.923198,2020-09-03 15:35:58.530272,0 days 00:00:05.607074,gbdt,,11.217893395148785,44,30,450,35,0.35,COMPLETE
51,51,0.11730856246681291,2020-09-03 15:35:58.542704,2020-09-03 15:36:03.038616,0 days 00:00:04.495912,gbdt,,4.358070104500758,13,25,300,15,0.45000000000000007,COMPLETE
52,52,0.3143103819736578,2020-09-03 15:36:03.047527,2020-09-03 15:36:10.977970,0 days 00:00:07.930443,gbdt,,0.8416304018835096,85,10,220,100,0.4,COMPLETE
53,53,0.3823433006020716,2020-09-03 15:36:10.981456,2020-09-03 15:36:19.247306,0 days 00:00:08.265850,gbdt,,0.40271188875611796,55,20,330,25,0.55,COMPLETE
54,54,0.10001496194882471,2020-09-03 15:36:19.253487,2020-09-03 15:36:23.262374,0 days 00:00:04.008887,gbdt,,7.2422652891826065,57,25,330,25,0.45000000000000007,COMPLETE
55,55,0.09058175864684562,2020-09-03 15:36:23.271764,2020-09-03 15:36:26.983642,0 days 00:00:03.711878,gbdt,,14.442413141543419,43,15,350,20,0.35,COMPLETE
56,56,0.13157736377393184,2020-09-03 15:36:26.986963,2020-09-03 15:36:30.833644,0 days 00:00:03.846681,gbdt,,4.130935803202732,53,90,270,25,0.5,COMPLETE
57,57,0.038893451589154616,2020-09-03 15:36:30.843585,2020-09-03 15:36:34.748519,0 days 00:00:03.904934,gbdt,,7.436223685279372,38,35,380,10,0.25,COMPLETE
58,58,0.14791428331176049,2020-09-03 15:36:34.754059,2020-09-03 15:36:46.990480,0 days 00:00:12.236421,goss,,0.6406488276091556,64,5,350,50,0.65,COMPLETE
59,59,0.0755842962883252,2020-09-03 15:36:47.004014,2020-09-03 15:36:50.896133,0 days 00:00:03.892119,gbdt,,19.45220811492011,53,20,300,40,0.6,COMPLETE
60,60,0.153425193958389,2020-09-03 15:36:50.899822,2020-09-03 15:36:55.418415,0 days 00:00:04.518593,gbdt,balanced,4.136338908034762,26,30,320,15,0.75,COMPLETE
61,61,0.3494020409174876,2020-09-03 15:36:55.426061,2020-09-03 15:37:08.301424,0 days 00:00:12.875363,gbdt,,0.25848815559151156,96,20,240,90,0.55,COMPLETE
62,62,0.3454366318986105,2020-09-03 15:37:08.308383,2020-09-03 15:37:19.002581,0 days 00:00:10.694198,gbdt,,0.45321347861276134,70,15,210,90,0.5,COMPLETE
63,63,0.10508146319349791,2020-09-03 15:37:19.008450,2020-09-03 15:37:22.913522,0 days 00:00:03.905072,gbdt,,9.873536256727066,60,25,250,95,0.4,COMPLETE
64,64,0.12302209126303776,2020-09-03 15:37:22.923263,2020-09-03 15:37:27.023963,0 days 00:00:04.100700,gbdt,,3.281807872381282,74,20,280,80,0.6,COMPLETE
65,65,0.12895640773384537,2020-09-03 15:37:27.030336,2020-09-03 15:37:30.140133,0 days 00:00:03.109797,gbdt,,14.06786471005833,19,10,170,85,0.55,COMPLETE
66,66,0.11792019148036634,2020-09-03 15:37:30.144565,2020-09-03 15:37:33.908537,0 days 00:00:03.763972,gbdt,,7.832869106029523,88,60,240,70,0.7000000000000001,COMPLETE
67,67,0.09873966836936363,2020-09-03 15:37:33.912959,2020-09-03 15:37:37.610166,0 days 00:00:03.697207,dart,,3.9069377302123556,3,30,200,30,0.65,COMPLETE
68,68,0.043314126014175926,2020-09-03 15:37:37.614658,2020-09-03 15:37:40.542015,0 days 00:00:02.927357,gbdt,,85.06192295772999,13,95,270,100,0.30000000000000004,COMPLETE
69,69,0.10414864924816658,2020-09-03 15:37:40.545982,2020-09-03 15:37:44.674519,0 days 00:00:04.128537,gbdt,,9.877153458175819,66,25,340,95,0.55,COMPLETE
70,70,0.3574692755605279,2020-09-03 15:37:44.685302,2020-09-03 15:37:51.413593,0 days 00:00:06.728291,gbdt,,0.7427922122105026,82,40,310,20,0.35,COMPLETE
71,71,0.13459948442199426,2020-09-03 15:37:51.424281,2020-09-03 15:37:56.017397,0 days 00:00:04.593116,gbdt,,2.6372139202343883,88,15,220,100,0.55,COMPLETE
72,72,0.3682394216515921,2020-09-03 15:37:56.031000,2020-09-03 15:38:06.860161,0 days 00:00:10.829161,gbdt,,0.5888298013487077,97,20,230,100,0.6,COMPLETE
73,73,0.3498894406625569,2020-09-03 15:38:06.865891,2020-09-03 15:38:21.822574,0 days 00:00:14.956683,gbdt,,0.13732699289568473,95,20,260,85,0.7000000000000001,COMPLETE
74,74,0.09474280948164256,2020-09-03 15:38:21.832352,2020-09-03 15:38:26.286054,0 days 00:00:04.453702,gbdt,,6.786172661956082,100,15,290,90,0.65,COMPLETE
75,75,0.11411986257881471,2020-09-03 15:38:26.290213,2020-09-03 15:38:29.731412,0 days 00:00:03.441199,gbdt,,12.374852191166312,54,25,190,95,0.5,COMPLETE
76,76,0.16475618843211923,2020-09-03 15:38:29.743720,2020-09-03 15:38:33.916540,0 days 00:00:04.172820,gbdt,,2.7146452166795982,92,10,240,100,0.6,COMPLETE
77,77,0.09674899957800756,2020-09-03 15:38:33.921489,2020-09-03 15:38:37.753969,0 days 00:00:03.832480,gbdt,,17.317933217290467,98,35,280,90,0.45000000000000007,COMPLETE
78,78,0.15520961673552824,2020-09-03 15:38:37.757802,2020-09-03 15:38:40.963855,0 days 00:00:03.206053,gbdt,,5.805822173125412,49,70,150,75,0.65,COMPLETE
79,79,0.11109562713272414,2020-09-03 15:38:40.969244,2020-09-03 15:38:49.505052,0 days 00:00:08.535808,goss,,50.26650169859564,46,20,230,100,0.5,COMPLETE
80,80,0.4172839877271331,2020-09-03 15:38:49.508413,2020-09-03 15:38:54.418310,0 days 00:00:04.909897,gbdt,,0.13528972805428777,81,5,40,95,0.75,COMPLETE
81,81,0.39232894851451555,2020-09-03 15:38:54.424782,2020-09-03 15:38:58.195015,0 days 00:00:03.770233,gbdt,,0.44065964762460386,90,15,30,95,0.8,COMPLETE
82,82,0.09940734744157367,2020-09-03 15:38:58.203597,2020-09-03 15:39:01.017621,0 days 00:00:02.814024,gbdt,,8.402636221090459,82,5,30,95,0.85,COMPLETE
83,83,0.11614383185767992,2020-09-03 15:39:01.026023,2020-09-03 15:39:04.485136,0 days 00:00:03.459113,gbdt,,2.5645189278482756,93,10,60,90,0.8,COMPLETE
84,84,0.41118708586988595,2020-09-03 15:39:04.501688,2020-09-03 15:39:09.366666,0 days 00:00:04.864978,gbdt,,0.1075296089872923,97,5,40,85,0.75,COMPLETE
85,85,0.09896783672101386,2020-09-03 15:39:09.381899,2020-09-03 15:39:12.465974,0 days 00:00:03.084075,gbdt,,5.094337448968943,86,5,10,85,0.75,COMPLETE
86,86,0.05685859027874118,2020-09-03 15:39:12.478416,2020-09-03 15:39:15.739558,0 days 00:00:03.261142,gbdt,,11.984731878733012,97,10,40,95,0.85,COMPLETE
87,87,0.41282106473297075,2020-09-03 15:39:15.754833,2020-09-03 15:39:20.425265,0 days 00:00:04.670432,gbdt,balanced,0.289729169667311,90,15,30,80,0.9,COMPLETE
88,88,0.11808572786944863,2020-09-03 15:39:20.432696,2020-09-03 15:39:23.973634,0 days 00:00:03.540938,dart,balanced,8.896540818569186,90,15,90,80,0.9,COMPLETE
89,89,0.12365996135301385,2020-09-03 15:39:23.985598,2020-09-03 15:39:26.680664,0 days 00:00:02.695066,gbdt,balanced,2.623799771854056,78,5,20,85,0.9500000000000001,COMPLETE
90,90,0.11955493411259495,2020-09-03 15:39:26.684255,2020-09-03 15:39:30.040677,0 days 00:00:03.356422,gbdt,balanced,68.84045431216481,90,10,70,80,0.75,COMPLETE
91,91,0.08022425056080144,2020-09-03 15:39:30.046644,2020-09-03 15:39:32.985515,0 days 00:00:02.938871,gbdt,balanced,6.2984562104386566,94,15,50,60,0.8,COMPLETE
92,92,0.37609344400584893,2020-09-03 15:39:32.989479,2020-09-03 15:39:40.667617,0 days 00:00:07.678138,gbdt,balanced,0.6507918354106645,85,25,110,90,0.9,COMPLETE
93,93,0.14852583267150887,2020-09-03 15:39:40.674222,2020-09-03 15:39:44.708049,0 days 00:00:04.033827,gbdt,balanced,2.806984493241301,83,25,100,90,0.9500000000000001,COMPLETE
94,94,0.07861944378719594,2020-09-03 15:39:44.712271,2020-09-03 15:39:47.636640,0 days 00:00:02.924369,gbdt,balanced,5.345011050237651,80,30,30,85,0.9500000000000001,COMPLETE
95,95,0.10611670503085029,2020-09-03 15:39:47.641225,2020-09-03 15:39:50.226177,0 days 00:00:02.584952,gbdt,balanced,98.90189833065233,76,25,10,95,0.85,COMPLETE
96,96,0.12957444817463676,2020-09-03 15:39:50.231501,2020-09-03 15:39:53.876734,0 days 00:00:03.645233,gbdt,balanced,1.9280737209337855,85,15,50,85,0.8,COMPLETE
97,97,0.1078100735964685,2020-09-03 15:39:53.884392,2020-09-03 15:39:56.487942,0 days 00:00:02.603550,gbdt,balanced,10.85977695372043,87,5,20,75,0.9,COMPLETE
98,98,0.39768465159727956,2020-09-03 15:39:56.496359,2020-09-03 15:40:02.715837,0 days 00:00:06.219478,gbdt,balanced,0.3610770057684411,90,85,70,90,1.0,COMPLETE
99,99,0.14559563599178918,2020-09-03 15:40:02.720255,2020-09-03 15:40:05.759112,0 days 00:00:03.038857,gbdt,balanced,5.3139969544320085,72,95,70,90,0.9500000000000001,COMPLETE
100,100,0.38584649323032394,2020-09-03 15:40:05.767887,2020-09-03 15:40:15.430418,0 days 00:00:09.662531,gbdt,balanced,0.22091195095362354,32,85,120,95,1.0,COMPLETE
101,101,0.07466793555028849,2020-09-03 15:40:15.434082,2020-09-03 15:40:19.401848,0 days 00:00:03.967766,gbdt,balanced,2.1509378590683075,34,80,120,95,0.9,COMPLETE
102,102,0.39302037934688777,2020-09-03 15:40:19.410405,2020-09-03 15:40:24.528647,0 days 00:00:05.118242,gbdt,balanced,0.46452541634144023,40,85,40,95,1.0,COMPLETE
103,103,0.41410969364428424,2020-09-03 15:40:24.531902,2020-09-03 15:40:29.454437,0 days 00:00:04.922535,gbdt,balanced,0.23432321467753095,40,85,40,95,1.0,COMPLETE
104,104,0.12420230319163147,2020-09-03 15:40:29.458136,2020-09-03 15:40:32.554599,0 days 00:00:03.096463,gbdt,balanced,7.161387781015958,41,80,40,95,1.0,COMPLETE
105,105,0.1306561687552347,2020-09-03 15:40:32.565318,2020-09-03 15:40:36.136524,0 days 00:00:03.571206,gbdt,balanced,4.224869619483183,38,85,80,95,1.0,COMPLETE
106,106,0.10118186090693124,2020-09-03 15:40:36.152813,2020-09-03 15:40:39.627644,0 days 00:00:03.474831,gbdt,balanced,8.891791618816246,30,90,60,100,1.0,COMPLETE
107,107,0.13116172881143162,2020-09-03 15:40:39.631579,2020-09-03 15:40:42.949155,0 days 00:00:03.317576,gbdt,balanced,3.103623256412068,46,85,40,90,1.0,COMPLETE
108,108,0.33591135235986513,2020-09-03 15:40:42.960668,2020-09-03 15:40:46.387522,0 days 00:00:03.426854,goss,balanced,0.1248217320989402,39,95,30,95,0.9500000000000001,COMPLETE
109,109,0.14531740511758479,2020-09-03 15:40:46.391763,2020-09-03 15:40:49.834573,0 days 00:00:03.442810,gbdt,balanced,5.318018147355383,36,75,60,100,0.9500000000000001,COMPLETE
110,110,0.32606525661447316,2020-09-03 15:40:49.845140,2020-09-03 15:40:52.392089,0 days 00:00:02.546949,gbdt,balanced,0.12670031103018256,27,85,20,90,0.30000000000000004,COMPLETE
111,111,0.32053728789846814,2020-09-03 15:40:52.397020,2020-09-03 15:40:55.138735,0 days 00:00:02.741715,gbdt,balanced,0.12506816814546245,32,75,10,95,1.0,COMPLETE
112,112,0.10928111868035292,2020-09-03 15:40:55.141786,2020-09-03 15:40:58.474978,0 days 00:00:03.333192,gbdt,balanced,2.1423705865816536,41,100,80,100,0.75,COMPLETE
113,113,0.14304072507146454,2020-09-03 15:40:58.479147,2020-09-03 15:41:01.117100,0 days 00:00:02.637953,gbdt,balanced,4.267086825383538,42,85,40,95,0.4,COMPLETE
114,114,0.1319742686084083,2020-09-03 15:41:01.120750,2020-09-03 15:41:03.951305,0 days 00:00:02.830555,gbdt,balanced,7.319242802939981,23,70,30,90,0.8,COMPLETE
115,115,0.2054855877076494,2020-09-03 15:41:03.961369,2020-09-03 15:41:06.971382,0 days 00:00:03.010013,gbdt,balanced,1.650448751179726,37,90,50,10,1.0,COMPLETE
116,116,0.3232456108914002,2020-09-03 15:41:06.974785,2020-09-03 15:41:10.454890,0 days 00:00:03.480105,gbdt,balanced,0.11841101899992527,46,80,70,15,0.7000000000000001,COMPLETE
117,117,0.1515913859491943,2020-09-03 15:41:10.461416,2020-09-03 15:41:12.982401,0 days 00:00:02.520985,gbdt,balanced,10.430747842236883,14,95,20,50,0.25,COMPLETE
118,118,0.11045924265323019,2020-09-03 15:41:12.985914,2020-09-03 15:41:16.015871,0 days 00:00:03.029957,dart,,4.121464747872138,51,90,60,100,0.75,COMPLETE
119,119,0.4088611113789236,2020-09-03 15:41:16.022149,2020-09-03 15:41:22.869418,0 days 00:00:06.847269,gbdt,,0.13994647689352896,44,85,90,95,0.85,COMPLETE
120,120,0.1419852553835975,2020-09-03 15:41:22.873098,2020-09-03 15:41:25.906658,0 days 00:00:03.033560,gbdt,,6.337290701021305,44,85,90,95,0.85,COMPLETE
121,121,0.4193651687796983,2020-09-03 15:41:25.912737,2020-09-03 15:41:30.399213,0 days 00:00:04.486476,gbdt,,0.23482759485756688,48,80,40,90,0.85,COMPLETE
122,122,0.12990013746695545,2020-09-03 15:41:30.403319,2020-09-03 15:41:33.142814,0 days 00:00:02.739495,gbdt,,2.177870301803097,46,80,40,90,0.85,COMPLETE
123,123,0.1261138835438665,2020-09-03 15:41:33.149183,2020-09-03 15:41:35.865122,0 days 00:00:02.715939,gbdt,,3.784913890334855,32,90,10,85,0.9,COMPLETE
124,124,0.3882613515516212,2020-09-03 15:41:35.873543,2020-09-03 15:41:42.643382,0 days 00:00:06.769839,gbdt,,0.31855082494305925,48,85,80,95,0.9500000000000001,COMPLETE
125,125,0.15858843573564002,2020-09-03 15:41:42.653595,2020-09-03 15:41:45.832640,0 days 00:00:03.179045,gbdt,,7.781006294085064,51,85,90,90,0.9500000000000001,COMPLETE
126,126,0.4325074733668929,2020-09-03 15:41:45.843914,2020-09-03 15:41:52.547580,0 days 00:00:06.703666,gbdt,,0.13525116013019722,47,80,70,100,0.9,COMPLETE
127,127,0.4271415523843718,2020-09-03 15:41:52.550799,2020-09-03 15:41:57.717194,0 days 00:00:05.166395,gbdt,,0.10637546921858074,48,75,50,100,0.9,COMPLETE
128,128,0.14351680207978298,2020-09-03 15:41:57.720739,2020-09-03 15:42:00.637718,0 days 00:00:02.916979,gbdt,,2.831741495230209,43,70,50,100,0.85,COMPLETE
129,129,0.159130475027811,2020-09-03 15:42:00.641187,2020-09-03 15:42:03.464584,0 days 00:00:02.823397,gbdt,,5.583870809230861,57,75,30,100,0.9,COMPLETE
130,130,0.11175964549252945,2020-09-03 15:42:03.468507,2020-09-03 15:42:06.556492,0 days 00:00:03.087985,gbdt,,9.137605457779529,40,75,70,100,0.85,COMPLETE
131,131,0.404511513129287,2020-09-03 15:42:06.561310,2020-09-03 15:42:12.521383,0 days 00:00:05.960073,gbdt,,0.23393420383455943,48,80,60,95,0.9,COMPLETE
132,132,0.0819153833531916,2020-09-03 15:42:12.528580,2020-09-03 15:42:15.970015,0 days 00:00:03.441435,gbdt,,1.9687331188017931,47,80,50,90,0.8,COMPLETE
133,133,0.4184873004051015,2020-09-03 15:42:15.973662,2020-09-03 15:42:21.181510,0 days 00:00:05.207848,gbdt,,0.1766038996454215,44,75,60,95,0.9,COMPLETE
134,134,0.1063681264684589,2020-09-03 15:42:21.189315,2020-09-03 15:42:24.191147,0 days 00:00:03.001832,gbdt,,4.164723142491785,44,75,60,95,0.9,COMPLETE
