,number,value,datetime_start,datetime_complete,duration,params_boosting_type,params_class_weight,params_learning_rate,params_max_depth,params_min_data_in_leaf,params_n_estimators,params_num_leaves,params_sampling_strategy,state
672,672,0.04824242404269926,2020-09-03 18:23:41.497949,2020-09-03 18:23:45.446556,0 days 00:00:03.948607,dart,,47.41550671856008,86,55,210,85,0.9,COMPLETE
673,673,0.11919388629243796,2020-09-03 18:23:45.451439,2020-09-03 18:23:49.819692,0 days 00:00:04.368253,dart,,5.468081311141054,84,55,190,75,0.9500000000000001,COMPLETE
674,674,0.05837491494869389,2020-09-03 18:23:49.823785,2020-09-03 18:23:55.360958,0 days 00:00:05.537173,dart,,2.1844286353034317,91,50,210,80,0.9,COMPLETE
675,675,0.05802112917666532,2020-09-03 18:23:55.367831,2020-09-03 18:24:04.379974,0 days 00:00:09.012143,dart,,1.7937415786646675,85,55,230,75,0.9500000000000001,COMPLETE
676,676,0.05902908225211569,2020-09-03 18:24:04.383746,2020-09-03 18:24:09.044451,0 days 00:00:04.660705,dart,,8.232966732920213,88,50,220,80,0.9500000000000001,COMPLETE
677,677,0.07024466465179756,2020-09-03 18:24:09.048730,2020-09-03 18:24:13.691719,0 days 00:00:04.642989,dart,,3.28968246496426,82,50,200,75,0.9,COMPLETE
678,678,0.10103678464357861,2020-09-03 18:24:13.695398,2020-09-03 18:24:20.981745,0 days 00:00:07.286347,dart,,1.7681339287347315,87,55,180,85,0.85,COMPLETE
679,679,0.44616657923818626,2020-09-03 18:24:20.985732,2020-09-03 18:25:01.643531,0 days 00:00:40.657799,dart,balanced,0.18788089332024535,83,50,210,80,0.9500000000000001,COMPLETE
680,680,0.43651465169502784,2020-09-03 18:25:01.648092,2020-09-03 18:25:46.140527,0 days 00:00:44.492435,dart,,0.13367852998124422,81,50,230,75,0.9,COMPLETE
681,681,0.09661908790437054,2020-09-03 18:25:46.145425,2020-09-03 18:25:50.587592,0 days 00:00:04.442167,dart,,4.902228748574559,89,50,200,80,0.9500000000000001,COMPLETE
682,682,0.4343059735788235,2020-09-03 18:25:50.596240,2020-09-03 18:26:44.525941,0 days 00:00:53.929701,dart,,0.17453065353890648,85,55,240,85,0.9500000000000001,COMPLETE
683,683,0.04199624182479962,2020-09-03 18:26:44.532916,2020-09-03 18:26:48.179725,0 days 00:00:03.646809,dart,,83.41232701215317,80,45,170,75,0.9,COMPLETE
684,684,0.07965528521708204,2020-09-03 18:26:48.183795,2020-09-03 18:26:53.397180,0 days 00:00:05.213385,dart,,3.2052843942520703,83,40,220,85,0.9500000000000001,COMPLETE
685,685,0.45778530494615693,2020-09-03 18:26:53.406239,2020-09-03 18:27:38.666214,0 days 00:00:45.259975,dart,,0.1213248267194798,86,50,230,80,0.9,COMPLETE
686,686,0.10415915390323678,2020-09-03 18:27:38.673185,2020-09-03 18:27:44.176636,0 days 00:00:05.503451,dart,,6.368509759867632,91,55,240,80,0.9,COMPLETE
687,687,0.44734020028878974,2020-09-03 18:27:44.182990,2020-09-03 18:28:28.729641,0 days 00:00:44.546651,dart,,0.11931105628372672,87,50,230,80,0.85,COMPLETE
688,688,0.07273817535343514,2020-09-03 18:28:28.734031,2020-09-03 18:28:36.409569,0 days 00:00:07.675538,dart,,1.9329202435528923,94,50,220,80,0.9,COMPLETE
689,689,0.10420284891049203,2020-09-03 18:28:36.414334,2020-09-03 18:28:41.091383,0 days 00:00:04.677049,dart,,4.092361505979173,89,55,210,80,0.85,COMPLETE
690,690,0.4439146637984111,2020-09-03 18:28:41.098116,2020-09-03 18:29:30.078389,0 days 00:00:48.980273,dart,,0.16090281164730008,86,50,240,75,0.9,COMPLETE
691,691,0.0536263199920876,2020-09-03 18:29:30.081719,2020-09-03 18:29:37.337512,0 days 00:00:07.255793,dart,,1.9718767456847308,86,50,230,80,0.85,COMPLETE
692,692,0.45116283855972705,2020-09-03 18:29:37.342167,2020-09-03 18:30:17.596557,0 days 00:00:40.254390,dart,,0.12368234101811668,84,55,220,75,0.9,COMPLETE
693,693,0.4444521032260716,2020-09-03 18:30:17.605210,2020-09-03 18:31:01.821452,0 days 00:00:44.216242,dart,,0.1309586691239318,89,55,230,75,0.9,COMPLETE
694,694,0.45039128125364203,2020-09-03 18:31:01.825899,2020-09-03 18:31:47.578019,0 days 00:00:45.752120,dart,,0.13712505958519428,85,60,240,75,0.85,COMPLETE
695,695,0.43954159839680357,2020-09-03 18:31:47.590681,2020-09-03 18:32:37.409836,0 days 00:00:49.819155,dart,,0.1022666686011753,87,60,250,75,0.85,COMPLETE
696,696,0.08194153632532838,2020-09-03 18:32:37.414147,2020-09-03 18:32:42.272872,0 days 00:00:04.858725,dart,,3.103812897382267,84,60,240,75,0.75,COMPLETE
697,697,0.108481109466631,2020-09-03 18:32:42.277186,2020-09-03 18:32:46.746548,0 days 00:00:04.469362,dart,,5.287998931133189,85,60,240,75,0.8,COMPLETE
698,698,0.09696078485623974,2020-09-03 18:32:46.751145,2020-09-03 18:32:53.587012,0 days 00:00:06.835867,dart,,2.0651765934331943,87,60,250,75,0.85,COMPLETE
699,699,0.10714569732170258,2020-09-03 18:32:53.591898,2020-09-03 18:32:58.105152,0 days 00:00:04.513254,dart,,3.720786974542758,84,60,240,70,0.8,COMPLETE
700,700,0.4331791473995004,2020-09-03 18:32:58.109435,2020-09-03 18:33:41.944968,0 days 00:00:43.835533,dart,,0.18329751697666696,89,55,230,75,0.85,COMPLETE
701,701,0.14565518929487614,2020-09-03 18:33:41.949333,2020-09-03 18:33:50.187660,0 days 00:00:08.238327,goss,,1.8994211999548023,85,55,240,70,0.8,COMPLETE
702,702,0.11389447416112122,2020-09-03 18:33:50.193772,2020-09-03 18:33:54.379393,0 days 00:00:04.185621,dart,,6.462475364649221,87,55,220,75,0.85,COMPLETE
703,703,0.05419014688537973,2020-09-03 18:33:54.383783,2020-09-03 18:33:58.063399,0 days 00:00:03.679616,dart,,3.244838267491365,84,55,230,75,0.30000000000000004,COMPLETE
704,704,0.4324036241111946,2020-09-03 18:33:58.067105,2020-09-03 18:34:46.645733,0 days 00:00:48.578628,dart,balanced,0.10567761893285407,83,60,250,70,0.9,COMPLETE
705,705,0.10635571417595453,2020-09-03 18:34:46.651774,2020-09-03 18:34:53.723298,0 days 00:00:07.071524,dart,,1.9125737331306536,91,55,220,75,0.85,COMPLETE
706,706,0.43867174297938805,2020-09-03 18:34:53.727405,2020-09-03 18:35:36.064429,0 days 00:00:42.337024,dart,,0.1286505707782657,88,60,230,70,0.9,COMPLETE
707,707,0.4470581717760309,2020-09-03 18:35:36.067712,2020-09-03 18:36:20.298756,0 days 00:00:44.231044,dart,,0.10647246221698571,85,55,240,75,0.8,COMPLETE
708,708,0.05328746060986027,2020-09-03 18:36:20.304147,2020-09-03 18:36:24.989832,0 days 00:00:04.685685,dart,,4.7189148155928375,86,55,220,80,0.9,COMPLETE
709,709,0.06065627404240291,2020-09-03 18:36:24.993747,2020-09-03 18:36:31.467632,0 days 00:00:06.473885,dart,,2.248173980982213,82,50,250,75,0.85,COMPLETE
710,710,0.07450399167805603,2020-09-03 18:36:31.471873,2020-09-03 18:36:36.495815,0 days 00:00:05.023942,dart,,3.7332985771113227,83,55,230,80,0.9,COMPLETE
711,711,0.43817252149330327,2020-09-03 18:36:36.500010,2020-09-03 18:37:17.584562,0 days 00:00:41.084552,dart,,0.1509174543235929,87,60,220,75,0.9,COMPLETE
712,712,0.43661286523528914,2020-09-03 18:37:17.591647,2020-09-03 18:38:03.982397,0 days 00:00:46.390750,dart,,0.16129182332631084,92,50,240,70,0.9,COMPLETE
713,713,0.45053039488601226,2020-09-03 18:38:03.986275,2020-09-03 18:38:37.091507,0 days 00:00:33.105232,dart,,0.1411275391926904,85,55,200,75,0.85,COMPLETE
714,714,0.08633413697501749,2020-09-03 18:38:37.099691,2020-09-03 18:38:40.883210,0 days 00:00:03.783519,dart,,20.40540193575267,89,50,190,75,0.8,COMPLETE
715,715,0.44229521234202807,2020-09-03 18:38:40.887768,2020-09-03 18:39:11.182778,0 days 00:00:30.295010,dart,,0.10130077019165837,86,50,200,75,0.85,COMPLETE
716,716,0.08931678030890974,2020-09-03 18:39:11.189472,2020-09-03 18:39:15.324720,0 days 00:00:04.135248,dart,,7.907652737008864,85,55,210,80,0.8,COMPLETE
717,717,0.10473038771196304,2020-09-03 18:39:15.328544,2020-09-03 18:39:20.794962,0 days 00:00:05.466418,dart,,2.1115320744442267,89,50,190,75,0.85,COMPLETE
718,718,0.060830568126035635,2020-09-03 18:39:20.807221,2020-09-03 18:39:25.405814,0 days 00:00:04.598593,dart,,3.988018880808139,84,50,200,80,0.85,COMPLETE
719,719,0.44100648851086827,2020-09-03 18:39:25.410552,2020-09-03 18:40:00.134129,0 days 00:00:34.723577,dart,,0.10030021144990935,87,55,210,75,0.85,COMPLETE
720,720,0.0770896920364453,2020-09-03 18:40:00.137818,2020-09-03 18:40:05.800900,0 days 00:00:05.663082,dart,,2.1594428551001057,83,40,200,80,0.85,COMPLETE
721,721,0.44486132030556186,2020-09-03 18:40:05.807894,2020-09-03 18:40:44.830156,0 days 00:00:39.022262,dart,,0.11305972526802172,90,60,220,75,0.85,COMPLETE
722,722,0.08844033237638946,2020-09-03 18:40:44.834331,2020-09-03 18:40:48.917750,0 days 00:00:04.083419,dart,,4.474846981104391,85,55,180,75,0.8,COMPLETE
723,723,0.07351820896652755,2020-09-03 18:40:48.924509,2020-09-03 18:40:55.981309,0 days 00:00:07.056800,dart,,2.022715067036478,87,50,230,80,0.9,COMPLETE
724,724,0.07180548822806425,2020-09-03 18:40:55.988706,2020-09-03 18:41:00.116088,0 days 00:00:04.127382,dart,,5.631439135543979,82,45,210,75,0.85,COMPLETE
725,725,0.0772347453294607,2020-09-03 18:41:00.123079,2020-09-03 18:41:03.357297,0 days 00:00:03.234218,dart,,2.040865689629609,84,50,190,80,0.1,COMPLETE
726,726,0.056482616004767505,2020-09-03 18:41:03.362765,2020-09-03 18:41:08.261213,0 days 00:00:04.898448,dart,,3.321644421272131,86,45,220,75,0.9,COMPLETE
727,727,0.4467526013342457,2020-09-03 18:41:08.265314,2020-09-03 18:41:57.111592,0 days 00:00:48.846278,dart,,0.11109321692373232,82,55,250,70,0.9,COMPLETE
728,728,0.3906823611775903,2020-09-03 18:41:57.117645,2020-09-03 18:42:08.524950,0 days 00:00:11.407305,goss,,0.12585810559312297,88,45,220,80,0.9,COMPLETE
729,729,0.06840660966602108,2020-09-03 18:42:08.531244,2020-09-03 18:42:14.261409,0 days 00:00:05.730165,dart,,32.21769448400642,84,50,470,85,0.85,COMPLETE
730,730,0.07671811153290278,2020-09-03 18:42:14.267875,2020-09-03 18:42:18.207832,0 days 00:00:03.939957,dart,,12.073225063025221,90,40,200,75,0.9,COMPLETE
731,731,0.10454215366098452,2020-09-03 18:42:18.215238,2020-09-03 18:42:22.599923,0 days 00:00:04.384685,dart,,6.411672081624019,82,50,230,80,0.75,COMPLETE
732,732,0.08412720345212187,2020-09-03 18:42:22.608990,2020-09-03 18:42:29.688375,0 days 00:00:07.079385,dart,,2.0148990260735435,86,45,240,75,0.8,COMPLETE
733,733,0.07070939002755057,2020-09-03 18:42:29.692346,2020-09-03 18:42:33.323323,0 days 00:00:03.630977,dart,,98.53602926648378,83,55,210,70,0.9,COMPLETE
734,734,0.08936888954711572,2020-09-03 18:42:33.330533,2020-09-03 18:42:41.587242,0 days 00:00:08.256709,dart,balanced,1.942650723213187,88,45,230,75,0.85,COMPLETE
735,735,0.038996873854955164,2020-09-03 18:42:41.597605,2020-09-03 18:42:45.939359,0 days 00:00:04.341754,dart,,4.646846458054595,81,50,200,80,0.9,COMPLETE
736,736,0.4396787019254633,2020-09-03 18:42:45.944495,2020-09-03 18:43:16.532859,0 days 00:00:30.588364,dart,,0.10822183340846551,92,60,190,85,0.85,COMPLETE
737,737,0.06700884254988028,2020-09-03 18:43:16.539391,2020-09-03 18:43:20.650001,0 days 00:00:04.110610,dart,,3.1040103731256323,85,40,180,80,0.9,COMPLETE
738,738,0.10905309272881722,2020-09-03 18:43:20.654831,2020-09-03 18:43:28.817942,0 days 00:00:08.163111,dart,,1.8350854928233753,84,55,220,75,0.9,COMPLETE
739,739,0.11105860387567597,2020-09-03 18:43:28.821785,2020-09-03 18:43:33.761846,0 days 00:00:04.940061,dart,,3.4525768096026743,81,50,210,80,0.9500000000000001,COMPLETE
740,740,0.06187206164354649,2020-09-03 18:43:33.765908,2020-09-03 18:43:41.527073,0 days 00:00:07.761165,dart,,2.0003873605978324,86,45,250,85,0.85,COMPLETE
741,741,0.43828100563681005,2020-09-03 18:43:41.533437,2020-09-03 18:44:26.613434,0 days 00:00:45.079997,dart,,0.203124740466972,89,55,230,70,0.9500000000000001,COMPLETE
742,742,0.44017077954738004,2020-09-03 18:44:26.617618,2020-09-03 18:45:15.197107,0 days 00:00:48.579489,dart,,0.1607466765230661,82,50,240,75,0.9,COMPLETE
743,743,0.08419467149662381,2020-09-03 18:45:15.203415,2020-09-03 18:45:19.793070,0 days 00:00:04.589655,dart,,4.617317552282417,84,40,220,80,0.9500000000000001,COMPLETE
744,744,0.044431675235393216,2020-09-03 18:45:19.798129,2020-09-03 18:45:23.797939,0 days 00:00:03.999810,dart,,92.23359652429792,87,55,210,85,0.9,COMPLETE
745,745,0.4284243771847606,2020-09-03 18:45:23.801844,2020-09-03 18:46:18.203334,0 days 00:00:54.401490,dart,,0.1525763778172656,81,45,250,75,0.9500000000000001,COMPLETE
746,746,0.4411147928532039,2020-09-03 18:46:18.208975,2020-09-03 18:46:50.303399,0 days 00:00:32.094424,dart,,0.17727613741332116,85,50,200,70,0.85,COMPLETE
747,747,0.08630485669589662,2020-09-03 18:46:50.307348,2020-09-03 18:46:54.880929,0 days 00:00:04.573581,dart,,7.518689976153193,88,45,230,80,0.9,COMPLETE
748,748,0.09745118386024951,2020-09-03 18:46:54.884879,2020-09-03 18:47:02.215626,0 days 00:00:07.330747,dart,,2.0554962421596055,83,60,240,75,0.9500000000000001,COMPLETE
749,749,0.4330754708169975,2020-09-03 18:47:02.223441,2020-09-03 18:47:43.485179,0 days 00:00:41.261738,dart,,0.17408968382417364,81,50,220,75,0.9,COMPLETE
750,750,0.10231230670138573,2020-09-03 18:47:43.491071,2020-09-03 18:47:47.609893,0 days 00:00:04.118822,dart,,5.686103856635982,86,40,180,80,0.9500000000000001,COMPLETE
751,751,0.061963056670586145,2020-09-03 18:47:47.618980,2020-09-03 18:47:51.898474,0 days 00:00:04.279494,dart,,3.5693447722057496,91,50,190,85,0.9,COMPLETE
752,752,0.13120513854597807,2020-09-03 18:47:51.904266,2020-09-03 18:47:56.806844,0 days 00:00:04.902578,dart,,1.951715478917618,84,55,200,20,0.9500000000000001,COMPLETE
753,753,0.4386968320945016,2020-09-03 18:47:56.814169,2020-09-03 18:48:35.240525,0 days 00:00:38.426356,dart,,0.19746577484913794,81,45,210,75,0.9,COMPLETE
754,754,0.09014194028215665,2020-09-03 18:48:35.245119,2020-09-03 18:48:40.166104,0 days 00:00:04.920985,dart,,3.6816966868897802,94,50,230,80,0.85,COMPLETE
755,755,0.0643755043125062,2020-09-03 18:48:40.174377,2020-09-03 18:48:49.859476,0 days 00:00:09.685099,dart,,1.7789370067500885,83,45,210,70,0.9,COMPLETE
756,756,0.39565193321403314,2020-09-03 18:48:49.865065,2020-09-03 18:49:01.922011,0 days 00:00:12.056946,goss,,0.1272977385924436,87,50,240,75,0.9500000000000001,COMPLETE
757,757,0.07842123490716843,2020-09-03 18:49:01.927929,2020-09-03 18:49:05.886342,0 days 00:00:03.958413,dart,,4.735135694632711,90,40,170,80,0.8,COMPLETE
758,758,0.08024455968553867,2020-09-03 18:49:05.891954,2020-09-03 18:49:14.936034,0 days 00:00:09.044080,dart,,1.8868236776169505,85,55,260,70,0.9500000000000001,COMPLETE
759,759,0.4501843347932081,2020-09-03 18:49:14.946628,2020-09-03 18:49:57.631372,0 days 00:00:42.684744,dart,,0.11973790623238854,80,60,220,85,0.9,COMPLETE
760,760,0.0905682935861706,2020-09-03 18:49:57.635368,2020-09-03 18:50:02.361472,0 days 00:00:04.726104,dart,balanced,6.101105645763058,80,55,230,85,0.85,COMPLETE
761,761,0.4282759256826127,2020-09-03 18:50:02.365007,2020-09-03 18:50:46.989145,0 days 00:00:44.624138,dart,,0.19336911305362836,80,60,220,85,0.85,COMPLETE
762,762,0.4448970398876346,2020-09-03 18:50:46.994739,2020-09-03 18:51:42.709846,0 days 00:00:55.715107,dart,,0.13358548141097498,79,60,250,85,0.9,COMPLETE
763,763,0.09722645515007981,2020-09-03 18:51:42.718218,2020-09-03 18:51:47.693734,0 days 00:00:04.975516,dart,,3.4837009438810007,80,60,230,85,0.9,COMPLETE
764,764,0.08342300665427474,2020-09-03 18:51:47.699581,2020-09-03 18:51:54.942386,0 days 00:00:07.242805,dart,,1.9600397678106076,77,60,240,85,0.85,COMPLETE
765,765,0.08047692490601585,2020-09-03 18:51:54.947260,2020-09-03 18:51:59.542809,0 days 00:00:04.595549,dart,,9.648566545481913,81,60,220,85,0.9,COMPLETE
766,766,0.06776149236131646,2020-09-03 18:51:59.547336,2020-09-03 18:52:06.676139,0 days 00:00:07.128803,dart,,1.9449331553031057,78,60,240,90,0.9,COMPLETE
767,767,0.06541225636594877,2020-09-03 18:52:06.680364,2020-09-03 18:52:11.244775,0 days 00:00:04.564411,dart,,3.785809350329842,82,60,220,80,0.9,COMPLETE
768,768,0.07188883915980025,2020-09-03 18:52:11.248572,2020-09-03 18:52:17.486375,0 days 00:00:06.237803,dart,,2.236179003984074,82,40,230,80,0.85,COMPLETE
769,769,0.0887368284366454,2020-09-03 18:52:17.492906,2020-09-03 18:52:22.038055,0 days 00:00:04.545149,dart,,5.295014705213682,79,55,210,85,0.9,COMPLETE
770,770,0.41569605219307676,2020-09-03 18:52:22.042150,2020-09-03 18:53:17.739047,0 days 00:00:55.696897,dart,,0.2671588808642367,82,60,250,80,0.9,COMPLETE
771,771,0.4426627305503594,2020-09-03 18:53:17.743449,2020-09-03 18:54:22.666377,0 days 00:01:04.922928,dart,,0.13415198404947187,77,55,260,90,0.85,COMPLETE
772,772,0.06237923185666551,2020-09-03 18:54:22.672789,2020-09-03 18:54:30.697864,0 days 00:00:08.025075,dart,,1.8630554454382349,84,45,240,80,0.9,COMPLETE
773,773,0.07113775690403554,2020-09-03 18:54:30.702150,2020-09-03 18:54:35.514262,0 days 00:00:04.812112,dart,,3.4472428394271106,80,40,220,85,0.9,COMPLETE
774,774,0.09675566240767769,2020-09-03 18:54:35.518466,2020-09-03 18:54:39.945813,0 days 00:00:04.427347,dart,,6.811233012873462,83,45,210,80,0.85,COMPLETE
775,775,0.41770644975564775,2020-09-03 18:54:39.951685,2020-09-03 18:55:25.437774,0 days 00:00:45.486089,dart,,0.25911233979162096,76,55,220,85,0.9,COMPLETE
776,776,0.08903580469056016,2020-09-03 18:55:25.445438,2020-09-03 18:55:34.592766,0 days 00:00:09.147328,dart,,1.896984880125255,25,45,230,80,0.9500000000000001,COMPLETE
777,777,0.4442905909857341,2020-09-03 18:55:34.596973,2020-09-03 18:56:19.756195,0 days 00:00:45.159222,dart,,0.10169560200982772,79,55,240,75,0.9,COMPLETE
778,778,0.07867677630989425,2020-09-03 18:56:19.761769,2020-09-03 18:56:24.792303,0 days 00:00:05.030534,dart,,3.8976036881465848,84,60,230,90,0.85,COMPLETE
779,779,0.45208948813114364,2020-09-03 18:56:24.796723,2020-09-03 18:57:21.512711,0 days 00:00:56.715988,dart,,0.1409342297177596,80,45,250,80,0.9500000000000001,COMPLETE
780,780,0.44092890772146304,2020-09-03 18:57:21.516810,2020-09-03 18:58:18.297504,0 days 00:00:56.780694,dart,,0.10137699772495556,78,40,260,75,0.9,COMPLETE
781,781,0.05239084224842609,2020-09-03 18:58:18.302116,2020-09-03 18:58:27.954069,0 days 00:00:09.651953,dart,,1.9116577685253515,76,45,270,80,0.9500000000000001,COMPLETE
782,782,0.08920904806427168,2020-09-03 18:58:27.958045,2020-09-03 18:58:32.445868,0 days 00:00:04.487823,dart,,14.696697499108183,80,40,250,85,0.9,COMPLETE
783,783,0.39893555797758923,2020-09-03 18:58:32.453269,2020-09-03 18:58:45.392102,0 days 00:00:12.938833,goss,,0.13735793104100086,78,45,250,75,0.9500000000000001,COMPLETE
784,784,0.4467097366587903,2020-09-03 18:58:45.398380,2020-09-03 18:59:44.388156,0 days 00:00:58.989776,dart,,0.11130764959081835,80,45,260,80,0.85,COMPLETE
785,785,0.08554304009506397,2020-09-03 18:59:44.393610,2020-09-03 18:59:49.391374,0 days 00:00:04.997764,dart,,5.082420183049813,82,40,250,90,0.9,COMPLETE
786,786,0.029401358442189985,2020-09-03 18:59:49.398259,2020-09-03 18:59:53.662858,0 days 00:00:04.264599,dart,,67.32924929921555,75,45,250,75,0.9500000000000001,COMPLETE
787,787,0.0919233062849734,2020-09-03 18:59:53.669484,2020-09-03 18:59:58.910551,0 days 00:00:05.241067,dart,,3.2791607771801843,77,40,270,85,0.9,COMPLETE
788,788,0.057025226165072974,2020-09-03 18:59:58.915200,2020-09-03 19:00:07.949817,0 days 00:00:09.034617,dart,balanced,1.9276047715597635,80,45,240,75,0.9500000000000001,COMPLETE
789,789,0.10502125943634093,2020-09-03 19:00:07.958515,2020-09-03 19:00:10.966139,0 days 00:00:03.007624,dart,,7.592535714008901,73,45,240,80,0.25,COMPLETE
790,790,0.45711714336497994,2020-09-03 19:00:10.969940,2020-09-03 19:01:08.395898,0 days 00:00:57.425958,dart,,0.106501562458759,82,40,260,75,0.9,COMPLETE
791,791,0.09405392540085758,2020-09-03 19:01:08.399892,2020-09-03 19:01:13.558107,0 days 00:00:05.158215,dart,,3.4717010863873066,83,40,280,75,0.85,COMPLETE
792,792,0.4440639367757736,2020-09-03 19:01:13.562881,2020-09-03 19:02:07.338037,0 days 00:00:53.775156,dart,,0.12193862783064532,82,40,260,75,0.8,COMPLETE
793,793,0.44058856600248353,2020-09-03 19:02:07.342034,2020-09-03 19:03:11.242502,0 days 00:01:03.900468,dart,,0.14152006784222107,84,40,270,75,0.9500000000000001,COMPLETE
794,794,0.06970342907914152,2020-09-03 19:03:11.246968,2020-09-03 19:03:16.324365,0 days 00:00:05.077397,dart,,5.4050986745084275,82,40,270,75,0.9,COMPLETE
795,795,0.4426672244573072,2020-09-03 19:03:16.328339,2020-09-03 19:04:07.930478,0 days 00:00:51.602139,dart,,0.10550923809467563,85,40,250,75,0.9500000000000001,COMPLETE
796,796,0.10225399742303158,2020-09-03 19:04:07.937173,2020-09-03 19:04:14.561246,0 days 00:00:06.624073,dart,,2.2516679584300485,81,40,260,75,0.9,COMPLETE
797,797,0.4494558536195542,2020-09-03 19:04:14.566046,2020-09-03 19:05:11.778790,0 days 00:00:57.212744,dart,,0.11324895480770268,78,45,260,70,0.9500000000000001,COMPLETE
798,798,0.049847557390089635,2020-09-03 19:05:11.790399,2020-09-03 19:05:16.004364,0 days 00:00:04.213965,dart,,73.41008924696952,83,35,270,75,0.85,COMPLETE
799,799,0.05309414534934091,2020-09-03 19:05:16.009164,2020-09-03 19:05:20.124876,0 days 00:00:04.115712,dart,,3.447644912941645,75,45,160,80,0.9,COMPLETE
800,800,0.4431179700223403,2020-09-03 19:05:20.129736,2020-09-03 19:06:28.140023,0 days 00:01:08.010287,dart,,0.12463245438288317,72,40,280,75,0.9500000000000001,COMPLETE
801,801,0.07028362663846081,2020-09-03 19:06:28.147869,2020-09-03 19:06:34.163948,0 days 00:00:06.016079,dart,,2.754651627092723,79,45,250,80,0.9500000000000001,COMPLETE
802,802,0.062033177906406244,2020-09-03 19:06:34.174210,2020-09-03 19:06:45.211149,0 days 00:00:11.036939,dart,,1.8005194949251453,85,35,240,75,0.9,COMPLETE
803,803,0.4460417614696402,2020-09-03 19:06:45.215487,2020-09-03 19:07:46.616929,0 days 00:01:01.401442,dart,,0.10875066305392365,81,45,260,80,0.9500000000000001,COMPLETE
804,804,0.040773399106188705,2020-09-03 19:07:46.622152,2020-09-03 19:07:50.438874,0 days 00:00:03.816722,dart,,57.24330373853145,77,40,240,70,0.85,COMPLETE
805,805,0.08862358743659461,2020-09-03 19:07:50.442714,2020-09-03 19:07:55.027268,0 days 00:00:04.584554,dart,,5.572880878787136,83,45,250,75,0.9,COMPLETE
806,806,0.05555265429433037,2020-09-03 19:07:55.033893,2020-09-03 19:08:03.169238,0 days 00:00:08.135345,dart,,2.042278589246447,80,45,290,80,0.9,COMPLETE
807,807,0.1898186162065035,2020-09-03 19:08:03.175961,2020-09-03 19:08:07.164853,0 days 00:00:03.988892,dart,,29.66795921456843,85,40,230,25,0.9500000000000001,COMPLETE
