,number,value,datetime_start,datetime_complete,duration,params_boosting_type,params_class_weight,params_learning_rate,params_max_depth,params_min_data_in_leaf,params_n_estimators,params_num_leaves,params_sampling_strategy,state
404,404,0.44804096689085443,2020-09-03 16:34:14.148118,2020-09-03 16:35:19.921753,0 days 00:01:05.773635,dart,,0.13140627138466437,74,45,250,80,0.9,COMPLETE
405,405,0.08047119576044084,2020-09-03 16:35:19.929682,2020-09-03 16:35:24.916006,0 days 00:00:04.986324,dart,,8.65030723583263,79,45,200,80,0.9,COMPLETE
406,406,0.07477153914790605,2020-09-03 16:35:24.923147,2020-09-03 16:35:31.557498,0 days 00:00:06.634351,dart,,3.7228934679579684,74,40,230,80,0.85,COMPLETE
407,407,0.45084321592409066,2020-09-03 16:35:31.563848,2020-09-03 16:36:22.306823,0 days 00:00:50.742975,dart,,0.11232475053530314,76,45,230,75,0.9,COMPLETE
408,408,0.05682705058890242,2020-09-03 16:36:22.310695,2020-09-03 16:36:33.092681,0 days 00:00:10.781986,dart,,2.0055400212828633,75,45,260,80,0.9,COMPLETE
409,409,0.1444068177788504,2020-09-03 16:36:33.098752,2020-09-03 16:36:43.220777,0 days 00:00:10.122025,goss,,5.263403328991174,77,45,220,75,0.85,COMPLETE
410,410,0.11900786737685572,2020-09-03 16:36:43.231629,2020-09-03 16:36:53.807224,0 days 00:00:10.575595,dart,,1.9325804870153203,74,40,220,75,0.9,COMPLETE
411,411,0.0867914677435306,2020-09-03 16:36:53.818076,2020-09-03 16:37:03.200332,0 days 00:00:09.382256,dart,,1.950794273928323,68,45,240,75,0.9,COMPLETE
412,412,0.443707257447694,2020-09-03 16:37:03.207237,2020-09-03 16:37:54.059570,0 days 00:00:50.852333,dart,,0.11485349324164401,76,45,240,80,0.9,COMPLETE
413,413,0.0862106353511868,2020-09-03 16:37:54.069158,2020-09-03 16:37:58.799765,0 days 00:00:04.730607,dart,,3.733289614380957,76,40,240,80,0.85,COMPLETE
414,414,0.07040455571402551,2020-09-03 16:37:58.810663,2020-09-03 16:38:08.531235,0 days 00:00:09.720572,dart,,1.7781452915223237,79,50,250,75,0.9,COMPLETE
415,415,0.44081078402220236,2020-09-03 16:38:08.536323,2020-09-03 16:38:50.457289,0 days 00:00:41.920966,dart,,0.2104909913675444,77,45,230,70,0.85,COMPLETE
416,416,0.10497609020989587,2020-09-03 16:38:50.461508,2020-09-03 16:38:55.670234,0 days 00:00:05.208726,dart,,4.740751058807524,66,45,250,80,0.9,COMPLETE
417,417,0.07610262784551028,2020-09-03 16:38:55.673875,2020-09-03 16:39:00.412562,0 days 00:00:04.738687,dart,,6.538949491129782,75,50,250,80,0.9,COMPLETE
418,418,0.05641637669268573,2020-09-03 16:39:00.416877,2020-09-03 16:39:08.792623,0 days 00:00:08.375746,dart,,1.8938274071491665,70,45,230,75,0.9,COMPLETE
419,419,0.07831913178076508,2020-09-03 16:39:08.797340,2020-09-03 16:39:13.594659,0 days 00:00:04.797319,dart,,3.9721732626215,78,50,230,80,0.85,COMPLETE
420,420,0.43666008047937155,2020-09-03 16:39:13.607818,2020-09-03 16:39:46.472713,0 days 00:00:32.864895,dart,,0.11000400982920369,74,45,200,80,0.9,COMPLETE
421,421,0.08171347042463731,2020-09-03 16:39:46.480727,2020-09-03 16:39:56.289665,0 days 00:00:09.808938,dart,,1.871888587392354,69,40,270,75,0.9,COMPLETE
422,422,0.429207271336283,2020-09-03 16:39:56.294999,2020-09-03 16:41:01.968792,0 days 00:01:05.673793,dart,,0.18038992695666836,76,50,260,80,0.85,COMPLETE
423,423,0.09038819957492791,2020-09-03 16:41:01.975810,2020-09-03 16:41:06.052901,0 days 00:00:04.077091,dart,,16.684731074662544,63,45,200,75,0.9,COMPLETE
424,424,0.07832445302243687,2020-09-03 16:41:06.056874,2020-09-03 16:41:10.609786,0 days 00:00:04.552912,dart,,3.395077625115357,66,40,190,80,0.9,COMPLETE
425,425,0.0721389868941111,2020-09-03 16:41:10.614442,2020-09-03 16:41:17.749516,0 days 00:00:07.135074,dart,,2.097479596836523,73,45,220,80,0.9,COMPLETE
426,426,0.06788276638823329,2020-09-03 16:41:17.755759,2020-09-03 16:41:22.168288,0 days 00:00:04.412529,dart,,6.200669796900581,80,50,210,70,0.85,COMPLETE
427,427,0.44388212889956813,2020-09-03 16:41:22.172061,2020-09-03 16:42:10.533447,0 days 00:00:48.361386,dart,,0.1345145527321336,70,45,240,75,0.9,COMPLETE
428,428,0.43563356934757785,2020-09-03 16:42:10.537828,2020-09-03 16:42:59.561593,0 days 00:00:49.023765,dart,,0.2413148243909381,72,45,240,75,0.9,COMPLETE
429,429,0.08077609111617304,2020-09-03 16:42:59.565651,2020-09-03 16:43:04.439129,0 days 00:00:04.873478,dart,,3.622742692833807,70,40,240,75,0.9,COMPLETE
430,430,0.44248988801825356,2020-09-03 16:43:04.445814,2020-09-03 16:43:56.136897,0 days 00:00:51.691083,dart,,0.2023941695177955,74,45,250,70,0.9,COMPLETE
431,431,0.43451508606404676,2020-09-03 16:43:56.142402,2020-09-03 16:44:57.004325,0 days 00:01:00.861923,dart,,0.13765997522831136,76,45,270,75,0.85,COMPLETE
432,432,0.09159702931559206,2020-09-03 16:44:57.012939,2020-09-03 16:45:04.014550,0 days 00:00:07.001611,dart,,2.052755182827266,74,45,240,75,0.9,COMPLETE
433,433,0.03430235134289676,2020-09-03 16:45:04.019169,2020-09-03 16:45:08.697866,0 days 00:00:04.678697,dart,,5.143098390897016,71,40,250,70,0.9,COMPLETE
434,434,0.4264147642529396,2020-09-03 16:45:08.702158,2020-09-03 16:46:05.634178,0 days 00:00:56.932020,dart,,0.25178208012993347,78,45,260,70,0.9,COMPLETE
435,435,0.0867561704488548,2020-09-03 16:46:05.638705,2020-09-03 16:46:11.001689,0 days 00:00:05.362984,dart,,3.288539124870195,74,50,230,80,0.85,COMPLETE
436,436,0.07195506298326344,2020-09-03 16:46:11.005168,2020-09-03 16:46:17.838858,0 days 00:00:06.833690,dart,,2.1268851450144752,76,45,250,70,0.9,COMPLETE
437,437,0.10384598461361591,2020-09-03 16:46:17.843637,2020-09-03 16:46:22.090072,0 days 00:00:04.246435,dart,,9.933751612103451,72,40,230,75,0.9,COMPLETE
438,438,0.11979909427267688,2020-09-03 16:46:22.094723,2020-09-03 16:46:26.924944,0 days 00:00:04.830221,dart,,19.29608450010036,69,45,280,80,0.85,COMPLETE
439,439,0.12212277063616535,2020-09-03 16:46:26.929440,2020-09-03 16:46:37.321979,0 days 00:00:10.392539,dart,,1.8443742482503238,79,45,260,80,0.9,COMPLETE
440,440,0.44167604474176514,2020-09-03 16:46:37.326486,2020-09-03 16:47:18.979584,0 days 00:00:41.653098,dart,,0.1581110893875947,73,50,220,75,0.9,COMPLETE
441,441,0.43465568911710395,2020-09-03 16:47:18.985956,2020-09-03 16:48:05.152724,0 days 00:00:46.166768,dart,,0.15209302681482667,71,45,240,80,0.8,COMPLETE
442,442,0.10148755356475539,2020-09-03 16:48:05.156481,2020-09-03 16:48:09.501500,0 days 00:00:04.345019,dart,,7.431639628325577,75,40,210,75,0.9,COMPLETE
443,443,0.4525012464256203,2020-09-03 16:48:09.504671,2020-09-03 16:48:54.233395,0 days 00:00:44.728724,dart,,0.10983396256086557,77,50,230,80,0.9,COMPLETE
444,444,0.16994938687473576,2020-09-03 16:48:54.237609,2020-09-03 16:49:02.871410,0 days 00:00:08.633801,goss,,4.001315637060152,82,50,250,85,0.85,COMPLETE
445,445,0.44383558974711634,2020-09-03 16:49:02.875300,2020-09-03 16:49:50.244245,0 days 00:00:47.368945,dart,,0.10359869451763423,78,50,240,80,0.9,COMPLETE
446,446,0.04094942945739914,2020-09-03 16:49:50.253644,2020-09-03 16:49:57.584739,0 days 00:00:07.331095,dart,,1.9793106322373675,80,50,230,80,0.9500000000000001,COMPLETE
447,447,0.41556726930474175,2020-09-03 16:49:57.588492,2020-09-03 16:50:47.288668,0 days 00:00:49.700176,dart,,0.17413214372861646,78,50,240,80,0.85,COMPLETE
448,448,0.10253508626757386,2020-09-03 16:50:47.292381,2020-09-03 16:50:52.078905,0 days 00:00:04.786524,dart,,5.272821810052021,81,50,230,85,0.9,COMPLETE
449,449,0.4454682915703071,2020-09-03 16:50:52.085447,2020-09-03 16:51:37.964297,0 days 00:00:45.878850,dart,,0.15515550961095792,84,50,220,85,0.9500000000000001,COMPLETE
450,450,0.06798088780020821,2020-09-03 16:51:37.969446,2020-09-03 16:51:41.839115,0 days 00:00:03.869669,dart,,65.25959308170171,86,50,220,80,0.9500000000000001,COMPLETE
451,451,0.45190142291087776,2020-09-03 16:51:41.842929,2020-09-03 16:52:28.305528,0 days 00:00:46.462599,dart,,0.133206095711844,83,50,220,85,0.9500000000000001,COMPLETE
452,452,0.07398612648638787,2020-09-03 16:52:28.311520,2020-09-03 16:52:32.140666,0 days 00:00:03.829146,dart,,3.28749066504198,85,50,220,85,0.2,COMPLETE
453,453,0.03163051751119028,2020-09-03 16:52:32.148233,2020-09-03 16:52:36.485253,0 days 00:00:04.337020,dart,,74.81164222903139,83,50,230,85,0.9500000000000001,COMPLETE
454,454,0.04531987386471001,2020-09-03 16:52:36.489883,2020-09-03 16:52:40.877557,0 days 00:00:04.387674,dart,,59.35543834418448,83,50,220,85,0.9500000000000001,COMPLETE
455,455,0.4501349751180766,2020-09-03 16:52:40.882295,2020-09-03 16:53:24.283855,0 days 00:00:43.401560,dart,,0.15160217579334082,87,50,210,80,0.9500000000000001,COMPLETE
456,456,0.03489693771963505,2020-09-03 16:53:24.287835,2020-09-03 16:53:30.649878,0 days 00:00:06.362043,dart,,2.137584073457101,86,50,210,80,0.9500000000000001,COMPLETE
457,457,0.4411906214645427,2020-09-03 16:53:30.654523,2020-09-03 16:54:23.937542,0 days 00:00:53.283019,dart,,0.1521236662898214,89,50,240,80,0.9500000000000001,COMPLETE
458,458,0.10203814517654966,2020-09-03 16:54:23.941864,2020-09-03 16:54:28.790531,0 days 00:00:04.848667,dart,,3.7824098309294754,90,50,210,80,0.9500000000000001,COMPLETE
459,459,0.06387322420297879,2020-09-03 16:54:28.794739,2020-09-03 16:54:39.179233,0 days 00:00:10.384494,dart,,1.7937958048806641,83,50,220,85,0.9500000000000001,COMPLETE
460,460,0.059241937096607654,2020-09-03 16:54:39.183459,2020-09-03 16:54:44.109098,0 days 00:00:04.925639,dart,,5.4244639675244635,87,50,240,75,0.9500000000000001,COMPLETE
461,461,0.06423133401225005,2020-09-03 16:54:44.113628,2020-09-03 16:54:50.304934,0 days 00:00:06.191306,dart,,2.1415050763634347,87,50,230,80,0.9500000000000001,COMPLETE
462,462,0.42370222052716333,2020-09-03 16:54:50.309906,2020-09-03 16:55:32.434543,0 days 00:00:42.124637,dart,,0.2394171334597208,85,45,210,85,0.9500000000000001,COMPLETE
463,463,0.045381662006695814,2020-09-03 16:55:32.438617,2020-09-03 16:55:37.547076,0 days 00:00:05.108459,dart,,3.6742102589512444,81,50,220,80,0.9,COMPLETE
464,464,0.09027832675579298,2020-09-03 16:55:37.551355,2020-09-03 16:55:44.337509,0 days 00:00:06.786154,dart,,2.049541178095332,92,45,230,85,0.9500000000000001,COMPLETE
465,465,0.1021639542560225,2020-09-03 16:55:44.342279,2020-09-03 16:55:48.828969,0 days 00:00:04.486690,dart,,5.8188123111372505,88,50,210,75,0.9500000000000001,COMPLETE
466,466,0.44396768638224876,2020-09-03 16:55:48.832695,2020-09-03 16:56:40.448305,0 days 00:00:51.615610,dart,,0.16154773294033722,80,45,240,80,0.9,COMPLETE
467,467,0.4508703804817703,2020-09-03 16:56:40.452484,2020-09-03 16:57:34.513426,0 days 00:00:54.060942,dart,,0.11399865527613427,84,45,250,80,0.9,COMPLETE
468,468,0.43655271420380204,2020-09-03 16:57:34.517659,2020-09-03 16:58:42.696938,0 days 00:01:08.179279,dart,,0.18038969557431828,85,45,260,80,0.9,COMPLETE
469,469,0.4372419750339739,2020-09-03 16:58:42.701159,2020-09-03 16:59:43.003886,0 days 00:01:00.302727,dart,,0.14751451814545158,83,50,250,85,0.9,COMPLETE
470,470,0.07910954576922445,2020-09-03 16:59:43.007727,2020-09-03 16:59:47.957663,0 days 00:00:04.949936,dart,,3.519481327184849,84,45,240,75,0.9,COMPLETE
471,471,0.050072854196434945,2020-09-03 16:59:47.961577,2020-09-03 16:59:56.085998,0 days 00:00:08.124421,dart,,1.9171770454801424,79,40,220,80,0.9,COMPLETE
472,472,0.42734475284641393,2020-09-03 16:59:56.092107,2020-09-03 17:00:45.522386,0 days 00:00:49.430279,dart,,0.16314972146523482,83,50,230,80,0.9,COMPLETE
473,473,0.06081287224590722,2020-09-03 17:00:45.525729,2020-09-03 17:00:50.094504,0 days 00:00:04.568775,dart,,7.320141361425085,81,45,250,85,0.9,COMPLETE
474,474,0.11017060298775969,2020-09-03 17:00:50.097900,2020-09-03 17:01:00.258122,0 days 00:00:10.160222,goss,,3.916183509156234,85,50,270,80,0.9500000000000001,COMPLETE
475,475,0.07803741944873438,2020-09-03 17:01:00.262077,2020-09-03 17:01:05.013254,0 days 00:00:04.751177,dart,,13.684445750430621,82,45,260,85,0.85,COMPLETE
476,476,0.10444237366957436,2020-09-03 17:01:05.017120,2020-09-03 17:01:13.055626,0 days 00:00:08.038506,dart,,1.931132511397564,87,45,200,75,0.9500000000000001,COMPLETE
477,477,0.09092579552138849,2020-09-03 17:01:13.060539,2020-09-03 17:01:20.506931,0 days 00:00:07.446392,dart,,2.073108658480188,80,50,230,80,0.9,COMPLETE
478,478,0.0944414314283792,2020-09-03 17:01:20.511406,2020-09-03 17:01:25.457127,0 days 00:00:04.945721,dart,,4.97828485831382,89,45,210,85,0.9500000000000001,COMPLETE
479,479,0.07534815643857895,2020-09-03 17:01:25.465414,2020-09-03 17:01:34.678351,0 days 00:00:09.212937,dart,,1.8946981860741543,81,40,240,80,0.85,COMPLETE
480,480,0.08210924937168919,2020-09-03 17:01:34.681889,2020-09-03 17:01:39.834972,0 days 00:00:05.153083,dart,balanced,4.318406520517585,85,50,220,85,0.9,COMPLETE
481,481,0.44564827992980566,2020-09-03 17:01:39.839015,2020-09-03 17:02:36.332739,0 days 00:00:56.493724,dart,,0.1859862933449692,79,45,250,75,0.9500000000000001,COMPLETE
482,482,0.44038880939902486,2020-09-03 17:02:36.345381,2020-09-03 17:03:43.033646,0 days 00:01:06.688265,dart,,0.11630877501158768,84,45,270,75,0.9500000000000001,COMPLETE
483,483,0.44278968561560583,2020-09-03 17:03:43.041746,2020-09-03 17:04:25.906971,0 days 00:00:42.865225,dart,,0.19631550651277133,82,40,220,70,0.9500000000000001,COMPLETE
484,484,0.4448138415950865,2020-09-03 17:04:25.911883,2020-09-03 17:05:35.660144,0 days 00:01:09.748261,dart,,0.10053565293969582,83,40,280,75,0.9500000000000001,COMPLETE
485,485,0.058151094779519893,2020-09-03 17:05:35.670590,2020-09-03 17:05:42.706956,0 days 00:00:07.036366,dart,,3.19414905938299,81,40,310,75,0.9500000000000001,COMPLETE
486,486,0.4473336713752321,2020-09-03 17:05:42.721054,2020-09-03 17:06:45.662389,0 days 00:01:02.941335,dart,,0.13463744028813932,84,35,260,75,0.9500000000000001,COMPLETE
487,487,0.08428555681344078,2020-09-03 17:06:45.666051,2020-09-03 17:06:58.865693,0 days 00:00:13.199642,dart,,1.8548489279704876,87,35,290,75,0.9500000000000001,COMPLETE
488,488,0.09622864373515132,2020-09-03 17:06:58.877468,2020-09-03 17:07:05.423964,0 days 00:00:06.546496,dart,,7.950749416045846,84,30,280,75,0.9500000000000001,COMPLETE
489,489,0.44753026573015575,2020-09-03 17:07:05.433621,2020-09-03 17:08:12.588410,0 days 00:01:07.154789,dart,,0.13341134327033918,83,35,260,70,0.9500000000000001,COMPLETE
490,490,0.45311517228637177,2020-09-03 17:08:12.595082,2020-09-03 17:09:36.756378,0 days 00:01:24.161296,dart,,0.1312320901204895,85,35,290,70,0.9500000000000001,COMPLETE
491,491,0.08044907061932227,2020-09-03 17:09:36.760947,2020-09-03 17:09:42.476790,0 days 00:00:05.715843,dart,,5.404382035393762,86,35,280,75,0.9500000000000001,COMPLETE
492,492,0.08886042974399345,2020-09-03 17:09:42.487324,2020-09-03 17:09:48.489903,0 days 00:00:06.002579,dart,,3.047068991281707,88,35,290,65,0.9500000000000001,COMPLETE
493,493,0.025718866697950888,2020-09-03 17:09:48.493614,2020-09-03 17:09:53.369979,0 days 00:00:04.876365,dart,,88.1705084577585,89,30,310,65,0.9500000000000001,COMPLETE
494,494,0.06505706389722282,2020-09-03 17:09:53.376985,2020-09-03 17:10:02.598265,0 days 00:00:09.221280,dart,,2.230934899072799,85,35,300,70,0.9500000000000001,COMPLETE
495,495,0.06842681434331739,2020-09-03 17:10:02.603987,2020-09-03 17:10:16.042404,0 days 00:00:13.438417,dart,,1.878369221088433,83,35,290,70,0.9500000000000001,COMPLETE
496,496,0.07937194504984171,2020-09-03 17:10:16.047616,2020-09-03 17:10:22.079710,0 days 00:00:06.032094,dart,,3.9480133359526812,84,35,280,70,0.9500000000000001,COMPLETE
497,497,0.07008330975700712,2020-09-03 17:10:22.083995,2020-09-03 17:10:32.434441,0 days 00:00:10.350446,dart,,1.9625526417318662,86,30,270,65,0.9500000000000001,COMPLETE
498,498,0.428356653939401,2020-09-03 17:10:32.445776,2020-09-03 17:11:47.446745,0 days 00:01:15.000969,dart,,0.20744435923840956,82,35,270,75,0.9500000000000001,COMPLETE
499,499,0.42874324501383787,2020-09-03 17:11:47.454814,2020-09-03 17:13:05.907718,0 days 00:01:18.452904,dart,,0.22507725040544446,91,40,290,70,0.9500000000000001,COMPLETE
500,500,0.03712515495705664,2020-09-03 17:13:05.914253,2020-09-03 17:13:10.710580,0 days 00:00:04.796327,dart,,32.855300908745704,83,35,270,60,0.9500000000000001,COMPLETE
501,501,0.439013935800744,2020-09-03 17:13:10.715353,2020-09-03 17:14:11.901041,0 days 00:01:01.185688,dart,,0.16833102070694791,88,35,260,70,0.9500000000000001,COMPLETE
502,502,0.12806579991042286,2020-09-03 17:14:11.909234,2020-09-03 17:14:21.577807,0 days 00:00:09.668573,goss,,5.970332207305094,85,35,260,75,0.9500000000000001,COMPLETE
503,503,0.07256608664253317,2020-09-03 17:14:21.585269,2020-09-03 17:14:27.407928,0 days 00:00:05.822659,dart,,3.603736405028214,82,30,280,75,0.9500000000000001,COMPLETE
504,504,0.058149999917931516,2020-09-03 17:14:27.414857,2020-09-03 17:14:41.273492,0 days 00:00:13.858635,dart,,1.8610820369908005,79,35,300,75,0.9500000000000001,COMPLETE
505,505,0.08772954459299317,2020-09-03 17:14:41.281277,2020-09-03 17:14:46.643228,0 days 00:00:05.361951,dart,,4.109448827922628,81,40,280,75,0.9500000000000001,COMPLETE
506,506,0.06746419684752256,2020-09-03 17:14:46.647587,2020-09-03 17:14:59.815787,0 days 00:00:13.168200,dart,,1.698405435895389,84,40,260,70,0.9500000000000001,COMPLETE
507,507,0.07360715819553906,2020-09-03 17:14:59.820540,2020-09-03 17:15:04.570972,0 days 00:00:04.750432,dart,,6.075664760369843,86,40,260,75,0.9500000000000001,COMPLETE
508,508,0.4505868874057769,2020-09-03 17:15:04.575282,2020-09-03 17:16:00.143717,0 days 00:00:55.568435,dart,,0.16049341364417402,79,55,250,65,0.9500000000000001,COMPLETE
509,509,0.42948579896211936,2020-09-03 17:16:00.151029,2020-09-03 17:16:57.497374,0 days 00:00:57.346345,dart,balanced,0.285083276878229,80,55,250,65,0.9500000000000001,COMPLETE
510,510,0.4407107360172879,2020-09-03 17:16:57.501137,2020-09-03 17:17:52.743819,0 days 00:00:55.242682,dart,,0.12349981818620191,79,55,250,70,1.0,COMPLETE
511,511,0.0839151011694179,2020-09-03 17:17:52.747829,2020-09-03 17:17:59.064318,0 days 00:00:06.316489,dart,,3.127729682505478,78,55,260,70,0.9500000000000001,COMPLETE
512,512,0.07681498057798454,2020-09-03 17:17:59.073012,2020-09-03 17:18:05.604791,0 days 00:00:06.531779,dart,,2.226007901698593,82,55,250,65,0.9,COMPLETE
513,513,0.42945042527635735,2020-09-03 17:18:05.609190,2020-09-03 17:19:14.065767,0 days 00:01:08.456577,dart,,0.18468114171712713,87,30,270,75,0.9500000000000001,COMPLETE
514,514,0.10609882211671051,2020-09-03 17:19:14.070273,2020-09-03 17:19:19.230446,0 days 00:00:05.160173,dart,,4.761179367039734,80,35,200,70,0.9,COMPLETE
515,515,0.10382055444024971,2020-09-03 17:19:19.237291,2020-09-03 17:19:29.946774,0 days 00:00:10.709483,dart,,1.8994066208472007,84,60,270,60,1.0,COMPLETE
516,516,0.06860579465469832,2020-09-03 17:19:29.950832,2020-09-03 17:19:35.387751,0 days 00:00:05.436919,dart,,8.498970514416133,82,55,250,75,0.9500000000000001,COMPLETE
517,517,0.05729232924073122,2020-09-03 17:19:35.399970,2020-09-03 17:19:40.607274,0 days 00:00:05.207304,dart,,3.4466187766077963,78,40,230,75,1.0,COMPLETE
518,518,0.4234948394229291,2020-09-03 17:19:40.610681,2020-09-03 17:20:54.665171,0 days 00:01:14.054490,dart,,0.29128339658315866,80,40,290,65,0.9,COMPLETE
519,519,0.059318963093671094,2020-09-03 17:20:54.671494,2020-09-03 17:20:59.580903,0 days 00:00:04.909409,dart,,40.072441494079385,84,30,300,80,0.9500000000000001,COMPLETE
520,520,0.4305985401949994,2020-09-03 17:20:59.584120,2020-09-03 17:21:45.466911,0 days 00:00:45.882791,dart,,0.19516056753073452,77,35,210,80,0.9,COMPLETE
521,521,0.09490330844143849,2020-09-03 17:21:45.475961,2020-09-03 17:21:56.194548,0 days 00:00:10.718587,dart,,1.9482818428476347,93,55,260,70,1.0,COMPLETE
522,522,0.4322849344166304,2020-09-03 17:21:56.212958,2020-09-03 17:22:57.935995,0 days 00:01:01.723037,dart,,0.22463029238293883,89,60,250,75,0.9500000000000001,COMPLETE
523,523,0.45004317021596074,2020-09-03 17:22:57.944290,2020-09-03 17:23:35.388382,0 days 00:00:37.444092,dart,,0.16995509932161132,86,50,200,70,0.9500000000000001,COMPLETE
524,524,0.08608547856588505,2020-09-03 17:23:35.394805,2020-09-03 17:23:40.055183,0 days 00:00:04.660378,dart,,4.667086999699776,87,50,200,65,1.0,COMPLETE
525,525,0.07738354630659663,2020-09-03 17:23:40.060014,2020-09-03 17:23:44.376581,0 days 00:00:04.316567,dart,,6.679143011644127,86,50,190,70,0.9,COMPLETE
526,526,0.08382665691682564,2020-09-03 17:23:44.384446,2020-09-03 17:23:49.850973,0 days 00:00:05.466527,dart,,3.393359294144793,91,55,210,70,0.9500000000000001,COMPLETE
527,527,0.07031410350173359,2020-09-03 17:23:49.858181,2020-09-03 17:23:56.404044,0 days 00:00:06.545863,dart,,2.1918132502729955,83,50,210,65,1.0,COMPLETE
528,528,0.43317427897140914,2020-09-03 17:23:56.411064,2020-09-03 17:24:32.239136,0 days 00:00:35.828072,dart,,0.21100907862705034,85,50,200,70,0.9500000000000001,COMPLETE
529,529,0.07785608247767976,2020-09-03 17:24:32.242973,2020-09-03 17:24:39.232201,0 days 00:00:06.989228,dart,,2.060204651926271,88,55,190,75,0.9,COMPLETE
530,530,0.08560484795691554,2020-09-03 17:24:39.237561,2020-09-03 17:24:44.485428,0 days 00:00:05.247867,dart,,4.9042197442260065,82,50,220,70,0.9500000000000001,COMPLETE
531,531,0.13701338212987363,2020-09-03 17:24:44.489422,2020-09-03 17:24:54.875065,0 days 00:00:10.385643,goss,,1.7768630877417637,80,45,230,75,0.9,COMPLETE
532,532,0.4266941368458294,2020-09-03 17:24:54.885991,2020-09-03 17:27:09.132959,0 days 00:02:14.246968,dart,,0.10290144528705564,10,50,500,70,1.0,COMPLETE
533,533,0.45174041183130437,2020-09-03 17:27:09.137022,2020-09-03 17:27:45.870237,0 days 00:00:36.733215,dart,,0.1612903027152496,84,40,200,80,0.9500000000000001,COMPLETE
534,534,0.071177930385742,2020-09-03 17:27:45.875268,2020-09-03 17:27:50.442863,0 days 00:00:04.567595,dart,,11.07023321300018,85,40,200,75,0.9500000000000001,COMPLETE
535,535,0.43704207449547816,2020-09-03 17:27:50.450974,2020-09-03 17:28:33.761396,0 days 00:00:43.310422,dart,,0.15017210034242048,83,35,210,80,0.9500000000000001,COMPLETE
536,536,0.09123362414233147,2020-09-03 17:28:33.768190,2020-09-03 17:28:39.123982,0 days 00:00:05.355792,dart,,3.499534487159008,81,40,200,75,1.0,COMPLETE
